id,title,link,comments,user,timestamp,score
30600174,US to ban Russian oil imports over Ukraine invasion,https://www.usatoday.com/story/news/politics/2022/03/08/ukraine-us-expected-ban-russian-oil-imports/9422798002/,https://news.ycombinator.com/item?id=30600174,underscore_ku,2022-03-08T14:24:38,7.0
30619494,Russian Commission Backs Nationalization of Exited Western Businesses,https://www.wsj.com/livecoverage/russia-ukraine-latest-news-2022-03-09/card/russian-commission-backs-nationalization-of-exited-western-businesses-YmEMuTCPezVe08xDRqAB,https://news.ycombinator.com/item?id=30619494,JumpCrisscross,2022-03-09T20:22:53,7.0
30630794,E.U. sanctions demand Google block Russian state media from search results,https://www.washingtonpost.com/technology/2022/03/09/eu-google-sanctions/,https://news.ycombinator.com/item?id=30630794,perihelions,2022-03-10T18:48:54,7.0
30630904,"EU Bans Russian State-Owned Media from Search Results, Social Reshares",https://www.wsj.com/livecoverage/russia-ukraine-latest-news-2022-03-09/card/eu-orders-removal-of-russian-state-owned-media-from-search-results-social-media-reshares-Nxb4WXbCaQnCUMmL9Mvk,https://news.ycombinator.com/item?id=30630904,breck,2022-03-10T18:56:45,7.0
30625232,Is Russia Really About To Cut Itself Off From The Internet? What Can We Expect?,https://swarajyamag.com/world/is-russia-really-about-to-cut-itself-off-from-the-internet-and-what-can-we-expect-if-it-does,https://news.ycombinator.com/item?id=30625232,rustoo,2022-03-10T10:14:44,7.0
30632669,Ask HN: What's the chance of crushing Russia's economy collapsing world economy?,https://news.ycombinator.com/item?id=30632669,https://news.ycombinator.com/item?id=30632669,andrewstuart,2022-03-10T21:25:06,7.0
30676085,"DJI denies throttling Ukrainian drones, confirms trouble to AeroScope in Ukraine",https://petapixel.com/2022/03/14/dji-denies-throttling-ukrainian-army-drones-after-rumors-swirl/,https://news.ycombinator.com/item?id=30676085,giuliomagnifico,2022-03-14T18:25:40,7.0
30651902,Russia's Wars in Chechnya offer a-grim-warning of what could-be in Ukraine,https://text.npr.org/1085861999,https://news.ycombinator.com/item?id=30651902,News-Dog,2022-03-12T15:13:50,7.0
30636095,US officials believe Ukraine can maintain control of Kyiv for several more weeks,https://www.nbcnews.com/news/world/live-blog/ukraine-russia-war-live-updates-top-diplomats-meet-talks-kyiv-n1291419,https://news.ycombinator.com/item?id=30636095,MilnerRoute,2022-03-11T04:14:30,7.0
30652184,Why Putin is playing poker not chess (march 4),https://newlinesmag.com/argument/why-putin-is-playing-poker-not-chess/,https://news.ycombinator.com/item?id=30652184,jarbou,2022-03-12T15:53:22,7.0
30652224,"Shaming Apple and Texting Musk, a Ukraine Minister Uses Novel War Tactics",https://www.nytimes.com/2022/03/12/technology/ukraine-minister-war-digital.html,https://news.ycombinator.com/item?id=30652224,mikhael,2022-03-12T15:58:26,7.0
30616477,Ukraine's Zelensky says he has 'cooled' on joining NATO,https://www.businessinsider.com/ukraines-zelensky-says-he-has-cooled-on-joining-nato-2022-3,https://news.ycombinator.com/item?id=30616477,LittleMoveBig,2022-03-09T16:35:19,7.0
30670404,(BBC news) Ukraine: How China is censoring online discussion of the war,https://www.bbc.co.uk/news/60684682,https://news.ycombinator.com/item?id=30670404,ngcc_hk,2022-03-14T09:54:02,7.0
30676851,Ukraine crisis: US warns China against helping Russia,https://www.bbc.com/news/world-asia-china-60732486,https://news.ycombinator.com/item?id=30676851,ohiovr,2022-03-14T19:14:31,7.0
30625556,EU tells Google to delist Russian state media websites from search,https://www.engadget.com/eu-google-delist-russian-state-media-websites-search-104441509.html,https://news.ycombinator.com/item?id=30625556,perihelions,2022-03-10T11:01:33,7.0
30648080,"Bennett advises Zelensky to surrender to Russia, Zelensky refuses",https://www.jpost.com/israel-news/article-701041,https://news.ycombinator.com/item?id=30648080,bardc,2022-03-12T01:18:57,7.0
30647607,The NSA is probing the sabotage of satellite internet during Russia's invasion,https://www.reuters.com/world/europe/exclusive-us-spy-agency-probes-sabotage-satellite-internet-during-russian-2022-03-11/,https://news.ycombinator.com/item?id=30647607,re_re,2022-03-11T23:55:40,7.0
30620267,Sony suspends all Playstation sales in Russia over Ukraine war,https://www.cnbc.com/2022/03/09/sony-suspends-all-playstation-sales-in-russia-over-ukraine-war.html,https://news.ycombinator.com/item?id=30620267,HieronymusBosch,2022-03-09T21:31:48,7.0
30647043,Itch.io – Bundle for Ukraine,https://itch.io/b/1316/bundle-for-ukraine,https://news.ycombinator.com/item?id=30647043,depressedpanda,2022-03-11T22:47:49,7.0
30642936,What China’s Social Media Is Saying About Ukraine,https://www.theatlantic.com/ideas/archive/2022/03/china-xi-ukraine-war-america/627028/,https://news.ycombinator.com/item?id=30642936,gamechangr,2022-03-11T17:24:25,7.0
30661521,Mechanisms for Criminal Prosecution of Russia’s Aggression Against Ukraine,https://www.justsecurity.org/80626/mechanisms-for-criminal-prosecution-of-russias-aggression-against-ukraine/,https://news.ycombinator.com/item?id=30661521,room505,2022-03-13T14:32:46,7.0
30664707,Finnish University invites students fleeing Ukraine,https://www.helsinki.fi/en/news/war-ukraine,https://news.ycombinator.com/item?id=30664707,belter,2022-03-13T19:12:55,7.0
30680466,Russian M-427 encryption device,https://twitter.com/electrospaces/status/1503478697998929930,https://news.ycombinator.com/item?id=30680466,merlinscholz,2022-03-15T00:48:21,7.0
30619938,Backlash against Russian-branded gas stations hits Americans,https://abcnews.go.com/US/wireStory/local-lukoil-gas-stations-feel-sting-russia-backlash-83246741,https://news.ycombinator.com/item?id=30619938,georgecmu,2022-03-09T21:05:56,7.0
30620173,The Case for a No-Fly Zone in Ukraine,https://www.jurist.org/commentary/2022/03/christina-alam-ukraine-russia-no-fly-zone/,https://news.ycombinator.com/item?id=30620173,HellDunkel,2022-03-09T21:24:52,7.0
30622389,Chinese smartphone shipments to Russia plunge as rouble collapses,https://www.ft.com/content/8f3e0214-94b1-4d73-b34f-31c189437578,https://news.ycombinator.com/item?id=30622389,JumpCrisscross,2022-03-10T01:54:41,7.0
30642255,TikTok stars receive White House briefing on Ukraine,https://www.washingtonpost.com/technology/2022/03/11/tik-tok-ukraine-white-house/,https://news.ycombinator.com/item?id=30642255,jbegley,2022-03-11T16:48:52,7.0
30641698,All ProtonVPN servers in Russia are currently “under maintenance”,https://twitter.com/tommymysk/status/1502308923776413703,https://news.ycombinator.com/item?id=30641698,tosh,2022-03-11T16:15:21,7.0
30667517,Lithuania prime minister Ingrida Simonyte says Russia’s invasion was predictable,https://web.archive.org/web/20220303033707/https://www.economist.com/by-invitation/2022/03/02/lithuanias-prime-minister-ingrida-simonyte-says-russias-invasion-was-predictable,https://news.ycombinator.com/item?id=30667517,CRConrad,2022-03-14T01:21:55,7.0
30641618,Russia issues its own TLS certificates to get past global sanctions,https://www.siliconrepublic.com/comms/russia-internet-tls-certificates-domestic-sanctions,https://news.ycombinator.com/item?id=30641618,esher,2022-03-11T16:09:44,7.0
30638872,Russian Strikes Hit Western Ukraine as Offensive Widens,https://text.npr.org/1085978647,https://news.ycombinator.com/item?id=30638872,News-Dog,2022-03-11T12:09:26,7.0
30743061,Ukrainian Officials Say Russia Bombed a School with 400-People Sheltering Inside,https://text.npr.org/1087766244,https://news.ycombinator.com/item?id=30743061,News-Dog,2022-03-20T14:50:08,6.0
30650110,Telegram – Harm Reduction for Users in Russia and Ukraine – (EFF Updated),https://www.eff.org/deeplinks/2022/03/telegram-harm-reduction-users-russia-and-ukraine,https://news.ycombinator.com/item?id=30650110,News-Dog,2022-03-12T09:08:23,6.0
30747678,Stand with Ukraine Bundle,https://www.humblebundle.com/stand-with-ukraine-bundle,https://news.ycombinator.com/item?id=30747678,Kelamir,2022-03-20T23:02:02,6.0
30740806,Japan imposed Russia sanctions as it needs help if China invades Tokyo Kono says,https://www.scmp.com/news/asia/east-asia/article/3170772/ukraine-war-japan-imposed-russia-sanctions-it-needs-allies-if,https://news.ycombinator.com/item?id=30740806,rntn,2022-03-20T07:16:41,6.0
30648404,Belarus may be preparing to invade Ukraine,https://www.jpost.com/breaking-news/article-700998,https://news.ycombinator.com/item?id=30648404,wslh,2022-03-12T02:23:40,6.0
30734747,Russia faces a smartphone shortage as Apple and Samsung exit and China retreats,https://fortune.com/2022/03/19/russia-ukraine-war-sanctions-companies-apple-samsung-smartphone-shortage-china/,https://news.ycombinator.com/item?id=30734747,awb,2022-03-19T15:49:35,6.0
30736074,Vaccination status might predict views on the Russian invasion of Ukraine,https://www.thestar.com/news/investigations/2022/03/19/how-vaccination-status-might-predict-views-on-the-russian-invasion-of-ukraine.html,https://news.ycombinator.com/item?id=30736074,ranit,2022-03-19T18:06:53,6.0
30615235,Interesting clip with a Russian student in Sweden locked out of her bank account,https://www.svt.se/nyheter/lokalt/uppsala/ryska-irinas-betalkort-ar-frysta-forsoker-oppna-svenskt-konto,https://news.ycombinator.com/item?id=30615235,acadapter,2022-03-09T15:10:41,6.0
30610080,Concern Rising That Putin Could Use Nuclear Weapons,https://www.defenseone.com/threats/2022/03/concern-rising-putin-could-use-nuclear-weapons/362913/,https://news.ycombinator.com/item?id=30610080,cols,2022-03-09T01:51:58,6.0
30661531,Russian Internet Users are learning how to beat Putin's Internet Crackdown,https://lite.cnn.com/en/article/h_4b9845a414470e203399b50e3b48c74d,https://news.ycombinator.com/item?id=30661531,News-Dog,2022-03-13T14:34:14,6.0
30661235,Hackers build tool to let anyone text Russian citizens about the war in Ukraine,https://www.dailydot.com/debug/anonymous-hackers-text-russia-ukraine-war/,https://news.ycombinator.com/item?id=30661235,GrumpyNl,2022-03-13T13:56:45,6.0
30716988,"The March of Folly Resumed: Russia, Ukraine and the West",https://prruk.org/the-march-of-folly-resumed-russia-ukraine-and-the-west/,https://news.ycombinator.com/item?id=30716988,wrp,2022-03-17T23:27:03,6.0
30718756,I love the Russian people. That is why I have to tell you the truth,https://twitter.com/Schwarzenegger/status/1504426844199669762,https://news.ycombinator.com/item?id=30718756,latchkey,2022-03-18T04:31:52,6.0
30719187,Ukraine crisis: Russian news agency deletes victory editorial,https://www.bbc.com/news/technology-60562240,https://news.ycombinator.com/item?id=30719187,doener,2022-03-18T06:20:09,6.0
30595950,VPN services have become the most downloaded apps in Russia,https://licensingrussia.ru/article/9350-vpn-servisy-stali-samymi-skachivaemymi-v-rossii/,https://news.ycombinator.com/item?id=30595950,ani_obsessive,2022-03-08T02:58:59,6.0
30720135,A team of Polish programmers built a digital tool to evade Russian censorship,https://therecord.media/we-are-unstoppable-how-a-team-of-polish-programmers-built-a-digital-tool-to-evade-russian-censorship/,https://news.ycombinator.com/item?id=30720135,oedmarap,2022-03-18T09:35:11,6.0
30652426,‘Not the time to go poking around’: How former U.S. hackers view Russia,https://www.politico.com/news/2022/03/12/cyber-russia-hacking-security-00016598,https://news.ycombinator.com/item?id=30652426,arkadiyt,2022-03-12T16:24:18,6.0
30728413,No war One of our contributors is in the middle of the war in Ukraine,https://darkreader.org/blog/no-war/,https://news.ycombinator.com/item?id=30728413,Tijdreiziger,2022-03-18T22:32:09,6.0
30655071,IrishMP Richard Boyd Barrett calls out the double standards on Ukraine Palestine,https://www.youtube.com/watch?v=mu2uI0gZD-c,https://news.ycombinator.com/item?id=30655071,thro1,2022-03-12T21:31:11,6.0
30732938,Belgium delays nuclear energy exit 10 years due to Ukraine war,https://www.france24.com/en/live-news/20220318-belgium-delays-nuclear-energy-exit-10-years-due-to-ukraine-war,https://news.ycombinator.com/item?id=30732938,pseudolus,2022-03-19T11:27:14,6.0
30653189,The War in Ukraine Is Just Beginning,https://www.theatlantic.com/international/archive/2022/03/how-long-will-ukraine-russia-war-last/627036/,https://news.ycombinator.com/item?id=30653189,gamechangr,2022-03-12T17:49:16,6.0
30616985,It’s not too late to free ourselves from this idiotic addiction to Russian gas,https://www.theguardian.com/commentisfree/2022/mar/09/addiction-russian-gas-putin-military,https://news.ycombinator.com/item?id=30616985,_Microft,2022-03-09T17:07:07,6.0
30734946,Detention of Russian Spy Boss Shows Tension Over Stalled Ukraine Invasion,https://www.wsj.com/articles/reported-detention-of-russian-spy-boss-shows-tension-over-stalled-ukraine-invasion-u-s-officials-say-11647687601,https://news.ycombinator.com/item?id=30734946,jbegley,2022-03-19T16:11:34,6.0
30615711,Kyiv Declaration,https://kyivdeclaration.org/,https://news.ycombinator.com/item?id=30615711,harscoat,2022-03-09T15:46:24,6.0
30646117,Russia Issues Its Own TLS Certs,https://threatpost.com/russia-issues-its-own-tls-certs/178891/,https://news.ycombinator.com/item?id=30646117,caaqil,2022-03-11T21:16:58,6.0
30759378,Who is Russia's Top Field-Commander in Ukraine? – The U.S. isn't sure,https://lite.cnn.com/en/article/h_ac22315ce37b7acfe244b7fb1197dd82,https://news.ycombinator.com/item?id=30759378,News-Dog,2022-03-21T20:36:51,6.0
30623726,Ukrainian Hospital Bombing Increases Pressure on US and Allies to Stop Russia,https://lite.cnn.com/en/article/h_fdf52959aa1fccdf4ee0b59a0e732f62,https://news.ycombinator.com/item?id=30623726,News-Dog,2022-03-10T06:15:41,6.0
30627456,Crypto platform blocks thousands of Russia-linked wallets,https://www.bbc.co.uk/news/technology-60661763,https://news.ycombinator.com/item?id=30627456,rowanajmarshall,2022-03-10T14:44:13,6.0
30791957,BlackRock says Russia-Ukraine crisis could accelerate digital currencies,https://www.reuters.com/technology/blackrocks-fink-says-russia-ukraine-crisis-could-accelerate-digital-currencies-2022-03-24/,https://news.ycombinator.com/item?id=30791957,prostoalex,2022-03-24T16:16:41,6.0
30619672,US rejects Poland’s offer to send MiG-29 fighter jets to Ukraine,https://www.aljazeera.com/news/2022/3/9/us-rejects-poland-offer-to-send-mig-29-fighter-jets-to-ukraine,https://news.ycombinator.com/item?id=30619672,belter,2022-03-09T20:40:54,6.0
30625842,Asymmetric Logistics: The Case for a Ukrainian Drone Lift,https://blog.chatfield.io/asymmetric-logistics-the-case-for-a-ukrainian-drone-lift/,https://news.ycombinator.com/item?id=30625842,0xfaded,2022-03-10T11:44:33,6.0
30798807,Russia considers accepting Bitcoin for oil and gas,https://www.bbc.co.uk/news/business-60870100,https://news.ycombinator.com/item?id=30798807,samizdis,2022-03-25T05:05:37,6.0
30799350,China sees 'unprecedented' capital outflow since Russia invaded Ukraine,https://www.straitstimes.com/business/economy/china-sees-unprecedented-capital-outflow-since-russia-invaded-ukraine,https://news.ycombinator.com/item?id=30799350,kalimanzaro,2022-03-25T06:57:51,6.0
30799612,"EU clinches U.S. LNG deal, brushes off Russian rouble demand",https://finance.yahoo.com/news/eu-seeks-answers-energy-supply-231318196.html,https://news.ycombinator.com/item?id=30799612,rntn,2022-03-25T07:50:56,6.0
30799917,FBI trolls Russian embassy with geotargeted ads for disgruntled spies,https://arstechnica.com/tech-policy/2022/03/fbi-trolls-russian-embassy-with-geotargeted-ads-for-disgruntled-spies/,https://news.ycombinator.com/item?id=30799917,BerislavLopac,2022-03-25T08:57:53,6.0
30806579,Russia states more limited war goal to 'liberate' Donbass,https://www.reuters.com/world/europe/russia-says-first-phase-ukraine-operation-mostly-complete-focus-now-donbass-2022-03-25/,https://news.ycombinator.com/item?id=30806579,rntn,2022-03-25T20:11:55,6.0
30617461,I’m a Ukrainian Official. We Need More Help on the Digital Front,https://www.wired.com/story/ukrainian-official-digital-front/,https://news.ycombinator.com/item?id=30617461,incomplete,2022-03-09T17:32:59,6.0
30806617,UK exposes Russian spy agency behind cyber incidents,https://www.gov.uk/government/news/uk-exposes-russian-spy-agency-behind-cyber-incidents,https://news.ycombinator.com/item?id=30806617,colinprince,2022-03-25T20:16:24,6.0
30807326,"Inside Ukraine’s foreign legion of misfits, veterans, and war tourists",https://taskandpurpose.com/news/ukraine-foreign-legion/,https://news.ycombinator.com/item?id=30807326,ilamont,2022-03-25T21:44:42,6.0
30807800,YouTube blocks WION for reporting Russian statement,https://www.wionews.com/videos/gravitas-youtube-blocks-wion-for-reporting-russian-statement-465572,https://news.ycombinator.com/item?id=30807800,drummer,2022-03-25T22:58:38,6.0
30622127,Oliver Stone-produced “Ukraine on Fire” moves to Rumble after YouTube censorship,https://reclaimthenet.org/youtube-removes-ukraine-on-fire-documentary-rumble/,https://news.ycombinator.com/item?id=30622127,cato_the_elder,2022-03-10T01:17:18,6.0
30621163,How SpaceX got Starlink up and running in Ukraine: report,https://www.space.com/how-spacex-got-starlink-running-ukraine,https://news.ycombinator.com/item?id=30621163,pseudolus,2022-03-09T23:04:54,6.0
30620902,Under a foreign flag: Canadian veterans explain why they're fighting for Ukraine,https://www.cbc.ca/news/politics/ukraine-russia-putin-canadian-forces-1.6372259,https://news.ycombinator.com/item?id=30620902,belter,2022-03-09T22:38:05,6.0
30620687,Ukraine Conflict Updates,https://www.understandingwar.org/backgrounder/ukraine-conflict-updates,https://news.ycombinator.com/item?id=30620687,he0001,2022-03-09T22:14:38,6.0
30826877,Zelensky Gives Interview to Russian Journalists. Moscow Orders It Quashed,https://www.nytimes.com/2022/03/27/world/europe/russia-media-zelensky.html,https://news.ycombinator.com/item?id=30826877,justin66,2022-03-28T03:34:21,6.0
30627801,"Facebook Allows Accounts from Sanctioned Russians, in Violation of Sanctions",https://www.washingtonpost.com/technology/2022/03/10/russia-rebels-sanctions-facebook/,https://news.ycombinator.com/item?id=30627801,boplicity,2022-03-10T15:14:40,6.0
30630445,Twitter removes Russian embassy tweet on Mariupol bombing,https://www.theguardian.com/world/2022/mar/10/twitter-removes-russian-embassy-tweet-on-mariupol-bombing,https://news.ycombinator.com/item?id=30630445,underscore_ku,2022-03-10T18:23:16,6.0
30630815,Google Directly Integrating Air Raid Alerts into Android Phones in Ukraine,https://9to5google.com/2022/03/10/android-ukraine-air-raid-alerts/,https://news.ycombinator.com/item?id=30630815,alphabetting,2022-03-10T18:50:27,6.0
30756715,Holocaust survivor killed by Russian shelling in Kharkiv,https://www.bbc.com/news/world-europe-60826303,https://news.ycombinator.com/item?id=30756715,belter,2022-03-21T17:08:58,6.0
30757003,Biden labelled Putin as war criminal has put relations on the verge of rupture,https://www.cnbc.com/2022/03/21/russia-tells-us-envoy-that-relations-are-on-the-verge-of-rupture.html,https://news.ycombinator.com/item?id=30757003,donsupreme,2022-03-21T17:23:06,6.0
30757151,Unconfirmed Reports of Russian Bomber Entering Polish Airspace,https://www.marketscreener.com/news/latest/Unconfirmed-Reports-of-Russian-Bomber-Entering-Polish-Airspace-After-Poland-Announces-Possible-Peace--39818109/,https://news.ycombinator.com/item?id=30757151,type0,2022-03-21T17:32:12,6.0
30707620,How Putin managed to derussify East Ukraine in just 8 years?,https://twitter.com/kamilkazani/status/1504103672019513345,https://news.ycombinator.com/item?id=30707620,eveningcoffee,2022-03-17T04:16:35,6.0
30617961,Let's make a simple visualisation of dominance hierarchy within Russian economy,https://nitter.net/kamilkazani/status/1501394344095490048#m,https://news.ycombinator.com/item?id=30617961,Tomte,2022-03-09T18:10:55,6.0
30618140,“Absolutely convinced that Putin will fail” – Blinken,https://www.cnn.com/europe/live-news/ukraine-russia-putin-news-03-09-22/index.html,https://news.ycombinator.com/item?id=30618140,novateg,2022-03-09T18:24:18,6.0
30639136,Military drone likely flying from Ukraine crashes in Croatia,https://www.aljazeera.com/news/2022/3/11/military-drone-likely-flying-from-ukraine-crashes-in-croatia,https://news.ycombinator.com/item?id=30639136,tosh,2022-03-11T12:46:56,6.0
30765432,Fortnite has already raised $36M for Ukraine relief,https://www.theverge.com/2022/3/21/22988901/fortnite-ukraine-relief,https://news.ycombinator.com/item?id=30765432,thunderbong,2022-03-22T12:53:32,6.0
30639009,Video Analysis of Russian Attack on Ukrainian Nuclear-Plant – Almost Disastrous,https://text.npr.org/1085427380,https://news.ycombinator.com/item?id=30639009,News-Dog,2022-03-11T12:31:13,6.0
30638826,IMF No Longer Sees Russia Debt Default as Improbable Event,https://www.bloomberg.com/news/articles/2022-03-10/imf-no-longer-sees-russian-debt-default-as-an-improbable-event,https://news.ycombinator.com/item?id=30638826,vinnyglennon,2022-03-11T12:00:38,6.0
30766588,A Nobel Prize-Winning Russian Editor Will Donate His Medal for Ukraine Relief,https://text.npr.org/1088005073,https://news.ycombinator.com/item?id=30766588,News-Dog,2022-03-22T14:35:25,6.0
30618380,"Iconic Russian Car Maker, Known for Cold War Self-Reliance, Halts Production",https://www.wsj.com/articles/russian-car-maker-known-for-cold-war-self-reliance-idles-factories-11646828796,https://news.ycombinator.com/item?id=30618380,mudro_zboris,2022-03-09T18:41:40,6.0
30633699,Bellingcat Open-Source Intelligence: Why Ukraine Is Winning the Information War,https://time.com/6155869/bellingcat-eliot-higgins-ukraine-open-source-intelligence/,https://news.ycombinator.com/item?id=30633699,joak,2022-03-10T22:51:50,6.0
30604568,Getting a Sense of the Russian Soul,https://razib.substack.com/p/getting-a-sense-of-the-russian-soul,https://news.ycombinator.com/item?id=30604568,hunglee2,2022-03-08T19:04:30,6.0
30709437,Korea to remove tariff on rare gases for chip manufacturing amid Ukraine war,http://www.koreaherald.com/view.php?ud=20220317000685,https://news.ycombinator.com/item?id=30709437,sjreese,2022-03-17T10:11:17,6.0
30680842,Kyiv auto repair shop adapts captured Russian weapons for local forces,https://news.yahoo.com/kyiv-auto-repair-shop-adapts-195604717.html,https://news.ycombinator.com/item?id=30680842,RickJWagner,2022-03-15T01:41:35,6.0
30704051,Why Russians Support Putin’s War Against Ukrainians,https://nationalinterest.org/blog/buzz/why-russians-support-putin%E2%80%99s-war-against-ukrainians-201196,https://news.ycombinator.com/item?id=30704051,hardmaru,2022-03-16T21:01:38,6.0
30688096,Russian Pilots and Hospital Targetting,https://www.facebook.com/keksifarm.hayday/posts/3102522226685002,https://news.ycombinator.com/item?id=30688096,vinnyglennon,2022-03-15T17:21:34,6.0
30704510,The global chess game linking Russia's war in Ukraine and the Iran nuclear deal,https://www.telegraph.co.uk/world-news/2022/03/16/global-chess-game-linking-russias-war-ukraine-iran-nuclear-deal/,https://news.ycombinator.com/item?id=30704510,grupthink,2022-03-16T21:43:37,6.0
30701550,Biden announces additional $800M in security assistance to Ukraine,https://www.cnn.com/2022/03/15/politics/biden-military-assistance-ukraine/index.html,https://news.ycombinator.com/item?id=30701550,oldiphone,2022-03-16T17:24:23,6.0
30687632,Germany warns against use of anti-virus software made by Russia’s Kaspersky,https://www.timesofisrael.com/germany-warns-against-use-of-anti-virus-software-made-by-russias-kaspersky/,https://news.ycombinator.com/item?id=30687632,tiahura,2022-03-15T16:51:24,6.0
30687913,India reportedly explores yuan in oil trade with Russia,https://www.globaltimes.cn/page/202203/1254958.shtml,https://news.ycombinator.com/item?id=30687913,LittleMoveBig,2022-03-15T17:08:42,6.0
30668064,Russia asked China for military help,https://www.politico.com/news/2022/03/13/russia-china-military-equipment-00016893,https://news.ycombinator.com/item?id=30668064,737min,2022-03-14T02:53:25,6.0
30695608,Ukrainian Indie Games Bundle,https://store.steampowered.com/bundle/25237/Ukrainian_Indie_Games_Bundle/,https://news.ycombinator.com/item?id=30695608,app4soft,2022-03-16T05:25:04,6.0
30687922,What Caused the War? Ukraine and Russia in Historical Context [video],https://www.youtube.com/watch?v=mMZYKxgc9TE,https://news.ycombinator.com/item?id=30687922,zerof1l,2022-03-15T17:09:26,6.0
30613272,Coinbase banned Russian wallets even if it said it was immune to sanctions,https://scontent.fmxp9-1.fna.fbcdn.net/v/t39.30808-6/275495242_10220844291564192_1495535381783497012_n.jpg?_nc_cat=109&ccb=1-5&_nc_sid=8bfeb9&_nc_ohc=O_C9lk8C92wAX8Tv3YE&tn=ecJonvJ5vUczX1Dp&_nc_ht=scontent.fmxp9-1.fna&oh=00_AT9PXXgcyOYwEnWHjyi7w4ywxxsl8PPMBRJLEf66aZGEGQ&oe=622D4978,https://news.ycombinator.com/item?id=30613272,gw67,2022-03-09T11:12:42,6.0
30679274,Anti-war protester interrupts Russian TV news show,https://www.bbc.com/news/world-europe-60744605,https://news.ycombinator.com/item?id=30679274,musiciangames,2022-03-14T22:25:35,6.0
30693620,What Ukraine war news looks like from Russia,https://www.npr.org/2022/03/15/1086634309/russia-media-state-television-ukraine-war,https://news.ycombinator.com/item?id=30693620,stoicanalyst,2022-03-16T00:08:31,6.0
30688494,"Chernobyl, 200 Exhausted Staff Toil Round the Clock at Russian Gunpoint",https://www.wsj.com/articles/inside-chernobyl-200-exhausted-staff-toil-round-the-clock-at-russian-gunpoint-11647357032,https://news.ycombinator.com/item?id=30688494,mzs,2022-03-15T17:49:48,6.0
30688501,Russia supported European energy dependence by funding environmental groups,https://www.foxnews.com/world/russia-funding-environmental-groups-europe-united-state,https://news.ycombinator.com/item?id=30688501,version_five,2022-03-15T17:50:08,6.0
