id,title,link,comments,user,timestamp,score
30651766,An Ukrainian village armed with two flags defeated four Russian tanks,https://twitter.com/TOrynski/status/1502274459620855812,https://news.ycombinator.com/item?id=30651766,NicoJuicy,2022-03-12T14:53:06,15.0
30596898,Ukraine Thoughts and Links,https://astralcodexten.substack.com/p/ukraine-thoughts-and-links,https://news.ycombinator.com/item?id=30596898,feross,2022-03-08T06:01:34,15.0
30626373,UK says Russian commanders will be held to account for war crimes,https://www.reuters.com/world/europe/uk-says-russian-commanders-will-be-held-account-war-crimes-2022-03-10/,https://news.ycombinator.com/item?id=30626373,mudro_zboris,2022-03-10T12:55:47,15.0
30652717,Russian disinformation machinery falls apart amid the war in Ukraine,https://www.wired.com/story/putin-collapse-disinformation-machinery-ukraine/,https://news.ycombinator.com/item?id=30652717,mrlonglong,2022-03-12T16:57:09,15.0
30651932,How Putin’s rat-infested childhood shaped his philosophy on war,https://nypost.com/2022/03/12/how-putins-rat-infested-childhood-shaped-his-philosophy-on-war/,https://news.ycombinator.com/item?id=30651932,Bostonian,2022-03-12T15:18:45,15.0
30633169,Facebook and Instagram to temporarily allow calls for violence against Russians,https://twitter.com/Reuters/status/1502036658979495940,https://news.ycombinator.com/item?id=30633169,busymom0,2022-03-10T22:10:13,15.0
30681051,JetBrains Leaves Russia,https://twitter.com/devarbol/status/1503545586137632770,https://news.ycombinator.com/item?id=30681051,DarkContinent,2022-03-15T02:23:43,15.0
30628257,I Watched Russian TV So You Don’ Have To – On Russian TV Putin Is the Good Guy,https://www.theatlantic.com/politics/archive/2022/03/how-russian-tv-portrays-war-ukraine/627010/,https://news.ycombinator.com/item?id=30628257,gamechangr,2022-03-10T15:51:14,15.0
30606457,CERN suspends Russias observer status and all future collaboration over invasion,https://www.euronews.com/next/2022/03/08/ukraine-war-cern-suspends-russia-s-observer-status-and-all-future-collaboration-over-invas,https://news.ycombinator.com/item?id=30606457,joenathanone,2022-03-08T20:34:36,15.0
30753989,"Chinese Boeing jet crashes in mountains with 132 on board, no sign of survivors",https://www.reuters.com/world/china/china-eastern-airlines-passenger-jet-has-accident-guangxi-state-media-says-2022-03-21/,https://news.ycombinator.com/item?id=30753989,Willson50,2022-03-21T13:41:16,15.0
30757441,France delivered weapons to Russia until 2020,https://disclose.ngo/en/article/war-in-ukraine-how-france-delivered-weapons-to-russia-until-2020,https://news.ycombinator.com/item?id=30757441,matthewmorgan,2022-03-21T17:55:03,15.0
30603409,BBC to Resume Reporting from Russia,https://www.reuters.com/world/uk/bbc-resume-reporting-russia-2022-03-08/,https://news.ycombinator.com/item?id=30603409,mudro_zboris,2022-03-08T18:09:28,15.0
30642482,Recent 10x Increase in Cyberattacks on Ukraine,https://krebsonsecurity.com/2022/03/report-recent-10x-increase-in-cyberattacks-on-ukraine/,https://news.ycombinator.com/item?id=30642482,todsacerdoti,2022-03-11T17:00:02,15.0
30609994,Russian military doctrine calls limited nuclear strike “deescalation” Here’s why,https://thebulletin.org/2022/03/russian-military-doctrine-calls-a-limited-nuclear-strike-de-escalation-heres-why/,https://news.ycombinator.com/item?id=30609994,CRConrad,2022-03-09T01:35:17,15.0
30659712,Protests grow in Russia where they are being arrested for holding blank signs,https://old.reddit.com/r/interestingasfuck/comments/tcpq4h/protests_grow_in_russia_where_they_are_being/,https://news.ycombinator.com/item?id=30659712,cuu508,2022-03-13T09:52:12,15.0
30596014,"Dashboard of 5,330 sanctions against Russia",https://www.castellum.ai/russia-sanctions-dashboard,https://news.ycombinator.com/item?id=30596014,rexbee,2022-03-08T03:11:11,15.0
30797561,Ukraine’s Three-to-One Advantage-the moral is to the physical as three is to one,https://www.theatlantic.com/ideas/archive/2022/03/american-volunteer-foreign-fighters-ukraine-russia-war/627604/,https://news.ycombinator.com/item?id=30797561,sharadov,2022-03-25T00:58:23,15.0
30661585,"HackerOne takes $25,000 from Belarusian hacker in response to sanctions",https://twitter.com/xnwup/status/1502789820149608452,https://news.ycombinator.com/item?id=30661585,phwd,2022-03-13T14:38:57,15.0
30720052,Hiding Arnold Schwarzenegger in my product to spread the truth in Russia,https://casparwre.de/blog/arnold-schwarzenegger-ukraine/,https://news.ycombinator.com/item?id=30720052,mikiobraun,2022-03-18T09:18:35,15.0
30623163,The United States does not have chemical and biological weapons labs in Ukraine,https://twitter.com/StateDept/status/1501724524311678980,https://news.ycombinator.com/item?id=30623163,Jimmc414,2022-03-10T04:16:41,15.0
30827522,The drone operators who halted Russian convoy headed for Kyiv,https://www.theguardian.com/world/2022/mar/28/the-drone-operators-who-halted-the-russian-armoured-vehicles-heading-for-kyiv,https://news.ycombinator.com/item?id=30827522,FearNotDaniel,2022-03-28T05:52:02,15.0
30742123,Belgium delays nuclear energy exit 10 years due to Ukraine war,https://news.yahoo.com/belgium-delays-nuclear-energy-exit-210002773.html,https://news.ycombinator.com/item?id=30742123,throw0101a,2022-03-20T12:34:16,14.0
30740180,Russians using VPNs for truth on Ukraine starts fights among friends and family,https://www.washingtonpost.com/technology/2022/03/19/russia-vpn-internet/,https://news.ycombinator.com/item?id=30740180,webmaven,2022-03-20T04:40:31,14.0
30631774,Twitter removes Russian embassy tweet on Mariupol hospital bombing,https://www.reuters.com/world/twitter-removes-russian-embassy-tweet-mariupol-hospital-bombing-2022-03-10/,https://news.ycombinator.com/item?id=30631774,mudro_zboris,2022-03-10T20:09:23,14.0
30810550,"Philippines just the latest to spot, protest against Chinese spy ship",https://asianews.network/philippines-just-the-latest-to-spot-protest-against-chinese-spy-ship/,https://news.ycombinator.com/item?id=30810550,rntn,2022-03-26T09:59:54,14.0
30631793,China's promotion of Russian disinformation indicates where its loyalties lie,https://lite.cnn.com/en/article/h_0f3aeb574c94151d308bc327a4140c2f,https://news.ycombinator.com/item?id=30631793,rntn,2022-03-10T20:10:59,14.0
30636360,Tu-141 Drone from the War in Ukraine Apparently Crashed in Croatia,https://www.thedrive.com/the-war-zone/44697/ukrainian-tu-141-strizh-missile-like-drone-appears-to-have-crashed-in-croatia,https://news.ycombinator.com/item?id=30636360,markozivanovic,2022-03-11T04:54:07,14.0
30621924,Russia’s techies flee country they fear is ‘flying into an abyss’,https://www.ft.com/content/a8b53d7a-08c5-484e-9dc6-cd4b2d889e3f,https://news.ycombinator.com/item?id=30621924,awb,2022-03-10T00:45:15,14.0
30803742,Ukraine War: Civilians abducted as Russia tries to assert control,https://www.bbc.com/news/world-europe-60858363,https://news.ycombinator.com/item?id=30803742,onemoresoop,2022-03-25T15:58:51,14.0
30614348,"War in Ukraine: Russia soon unable to pay its debts, warns agency",https://www.bbc.co.uk/news/business-60672085,https://news.ycombinator.com/item?id=30614348,curtisblaine,2022-03-09T13:50:31,14.0
30593899,Ukraine Gave Up Nuclear Arms and Got Betrayed,https://theintercept.com/2022/02/27/ukraine-nuclear-weapons-russia-invasion/,https://news.ycombinator.com/item?id=30593899,justin66,2022-03-07T22:02:39,14.0
30718503,Studying the Script: Finding Chinese inscriptions on turtle shells,https://www.laphamsquarterly.org/roundtable/studying-script,https://news.ycombinator.com/item?id=30718503,Caiero,2022-03-18T03:35:58,14.0
30719352,Would Russia Have Invaded Ukraine If They Had Nuclear Weapons?,https://www.19fortyfive.com/2022/03/would-russia-have-invaded-ukraine-if-they-had-nuclear-weapons/,https://news.ycombinator.com/item?id=30719352,rntn,2022-03-18T07:02:40,14.0
30596869,The distributed web isn’t ready for Russian Runet cutoff from the Internet,https://www.ctrl.blog/entry/dweb-readiness-runet.html,https://news.ycombinator.com/item?id=30596869,giuliomagnifico,2022-03-08T05:54:58,14.0
30791998,Blundering into a nuclear war in Ukraine: a hypothetical scenario,https://www.nti.org/atomic-pulse/blundering-into-a-nuclear-war-in-ukraine-a-hypothetical-scenario/,https://news.ycombinator.com/item?id=30791998,spuz,2022-03-24T16:19:42,14.0
30618834,Finland reports GPS disturbances in aircrafts flying over Russia’s Kaliningrad,https://www.theguardian.com/world/2022/mar/09/finland-gps-disturbances-aircrafts-russia,https://news.ycombinator.com/item?id=30618834,fy20,2022-03-09T19:21:49,14.0
30580248,Update on Spotify’s compliance with Russian censorship,https://copyriot.se/2022/03/06/update-on-spotifys-compliance-with-russian-censorship/,https://news.ycombinator.com/item?id=30580248,unicornporn,2022-03-06T19:18:58,14.0
30600337,I Was Wrong About Putin,https://www.theatlantic.com/ideas/archive/2022/03/putin-russian-political-deterioration/626966/,https://news.ycombinator.com/item?id=30600337,gamechangr,2022-03-08T14:38:40,14.0
30753690,Is Russia Losing?,https://www.vox.com/2022/3/18/22977801/russia-ukraine-war-losing-map-kyiv-kharkiv-odessa-week-three,https://news.ycombinator.com/item?id=30753690,hochmartinez,2022-03-21T13:09:45,13.0
30598690,UN Says Ukrainian Refugees Surpass 2M,https://www.rferl.org/a/ukraine-russia-refugees-united-nations/31742605.html,https://news.ycombinator.com/item?id=30598690,underscore_ku,2022-03-08T11:16:16,13.0
30609687,The curious case of Russia’s missing Air Force,https://www.economist.com/interactive/2022/03/08/curious-case-russias-missing-air-force,https://news.ycombinator.com/item?id=30609687,awb,2022-03-09T00:59:43,13.0
30632524,Russian soldiers offered 5M rubles in cryptocurrency for surrendering,https://kyivindependent.com/uncategorized/russian-soldiers-offered-5-million-rubles-in-cryptocurrency-for-surrendering-to-ukrainian-army/,https://news.ycombinator.com/item?id=30632524,belter,2022-03-10T21:13:11,13.0
30620764,Crowdsourced map of Russia-Ukraine war videos,https://www.info-res.org/map,https://news.ycombinator.com/item?id=30620764,geox,2022-03-09T22:22:30,13.0
30606939,"McDonald’s, Starbucks and Coca-Cola Suspend Russian Operations",https://www.theguardian.com/world/2022/mar/08/mcdonalds-bows-to-pressure-and-closes-all-its-russian-restaurants,https://news.ycombinator.com/item?id=30606939,sofixa,2022-03-08T21:05:24,13.0
30768979,Ukraine captures Russian electronic warfare system to jam AWACS,https://twitter.com/UAWeapons/status/1506306740421341193,https://news.ycombinator.com/item?id=30768979,ilamont,2022-03-22T17:30:56,13.0
30612313,Russia’s techies flee country they fear is ‘flying into an abyss’,https://www.ft.com/content/a8b53d7a-08c5-484e-9dc6-cd4b2d889e3f,https://news.ycombinator.com/item?id=30612313,vinnyglennon,2022-03-09T08:52:39,13.0
30618242,"Russia admits conscripts have been fighting in Ukraine, despite previous denials",https://www.cnn.com/2022/03/09/europe/russia-conscripts-fighting-ukraine-intl/index.html,https://news.ycombinator.com/item?id=30618242,mudro_zboris,2022-03-09T18:32:03,13.0
30649269,Ukraine: Spam website set up to reach millions of Russians,https://www.bbc.co.uk/news/technology-60697261,https://news.ycombinator.com/item?id=30649269,jw1224,2022-03-12T05:49:53,13.0
30600520,JetBrains is openly supporting Ukraine,https://github.com/vshymanskyy/StandWithUkraine/issues/11,https://news.ycombinator.com/item?id=30600520,afandian,2022-03-08T14:53:30,13.0
30613273,US looks to keep Ukrainian 'biological research facilities' from Russian control,https://www.washingtonexaminer.com/policy/defense-national-security/us-looks-to-keep-ukrainian-biological-research-facilities-from-russian-control,https://news.ycombinator.com/item?id=30613273,tqxvak,2022-03-09T11:12:42,13.0
30733953,Russia’s mistakes and Ukrainian resistance altered Putin’s war,https://ig.ft.com/russias-war-in-ukraine-mapped/,https://news.ycombinator.com/item?id=30733953,stared,2022-03-19T14:25:25,13.0
30792449,PRC blocks Wikimedia and others from UN agencies over Taiwan issue,https://twitter.com/mcculloughirvin/status/1507004153972682754,https://news.ycombinator.com/item?id=30792449,ilamont,2022-03-24T16:53:11,13.0
30599159,OSINT researchers went viral unpacking the war in Ukraine,https://restofworld.org/2022/osint-viral-ukraine/,https://news.ycombinator.com/item?id=30599159,donohoe,2022-03-08T12:30:43,13.0
30634515,"Russian Offensive Campaign Assessment, March 10",https://www.understandingwar.org/backgrounder/russian-offensive-campaign-assessment-march-10,https://news.ycombinator.com/item?id=30634515,optimalsolver,2022-03-11T00:22:20,13.0
30647783,Mearsheimer on why the West is principally responsible for the Ukrainian crisis,https://www.economist.com/by-invitation/2022/03/11/john-mearsheimer-on-why-the-west-is-principally-responsible-for-the-ukrainian-crisis,https://news.ycombinator.com/item?id=30647783,cf141q5325,2022-03-12T00:24:55,13.0
30781610,How Europe Got Hooked on Russian Gas Despite Reagan’s Warnings,https://www.nytimes.com/2022/03/23/climate/europe-russia-gas-reagan.html,https://news.ycombinator.com/item?id=30781610,toomanyrichies,2022-03-23T18:22:56,13.0
30800841,NATO Bombing of Yugoslavia,https://en.wikipedia.org/wiki/NATO_bombing_of_Yugoslavia,https://news.ycombinator.com/item?id=30800841,belter,2022-03-25T11:34:42,13.0
30634393,Should Ireland Join NATO?,https://www.rte.ie/brainstorm/2022/0309/1285375-ireland-nato-membership-neutrality-defence-policies/,https://news.ycombinator.com/item?id=30634393,mudro_zboris,2022-03-11T00:07:35,13.0
30741554,I Served As A Conscript In The Russian Infantry. AMA.,https://old.reddit.com/r/neoliberal/comments/t4e7jk/i_served_as_conscript_in_russian_unfantry_in/,https://news.ycombinator.com/item?id=30741554,optimalsolver,2022-03-20T10:34:26,13.0
30605375,"Zelensky: “No Longer Pursuing NATO Membership, Open to Compromise on DNR/LNR”",https://www.straitstimes.com/world/europe/in-nod-to-russia-ukraine-says-no-longer-insisting-on-nato-membership,https://news.ycombinator.com/item?id=30605375,deutschew,2022-03-08T19:36:48,13.0
30801126,China finalising security deal with Solomon Islands to base warships in Pacific,https://www.theguardian.com/world/2022/mar/24/china-finalising-security-deal-with-solomon-islands-to-base-warships-in-the-pacific,https://news.ycombinator.com/item?id=30801126,rntn,2022-03-25T12:07:57,13.0
30660196,Russia creates its own TLS certificate authority to bypass sanctions,https://www.techradar.com/news/russia-creates-its-own-tls-certificate-authority-to-bypass-sanctions,https://news.ycombinator.com/item?id=30660196,TekMol,2022-03-13T11:10:41,13.0
30633543,"Satellite images of flooding north of Kyiv, possible sign of ‘hydraulic warfare’",https://www.washingtonpost.com/world/2022/03/09/ukraine-intentional-flooding/,https://news.ycombinator.com/item?id=30633543,cato_the_elder,2022-03-10T22:38:07,12.0
30618133,Russian troops wave Soviet Union flag from tanks inside Ukraine,https://www.independent.co.uk/tv/news/russian-troops-soviet-union-flag-ukraine-b2023137.html,https://news.ycombinator.com/item?id=30618133,belter,2022-03-09T18:23:51,12.0
30782596,Ask HN: How is it beneficial for Russia to only accept payments in rubles,https://news.ycombinator.com/item?id=30782596,https://news.ycombinator.com/item?id=30782596,weinzierl,2022-03-23T19:57:42,12.0
30640041,Russia moves to declare Meta an 'extremist' organization,https://www.businessinsider.com/russia-meta-facebook-court-delcare-extremist-organization-2022-3,https://news.ycombinator.com/item?id=30640041,ideksec,2022-03-11T14:07:30,12.0
30604986,"Coinbase blocks 25,000 Russia-linked crypto addresses",https://blog.coinbase.com/using-crypto-tech-to-promote-sanctions-compliance-8a17b1dabd68,https://news.ycombinator.com/item?id=30604986,Mistri,2022-03-08T19:21:17,12.0
30764347,"No OpenTTD Android update this year, I was conscripted into Ukrainian army",https://old.reddit.com/r/openttd/comments/tjapqt/there_will_be_no_openttd_android_version_update/,https://news.ycombinator.com/item?id=30764347,jandeboevrie,2022-03-22T09:57:13,12.0
30604938,Senators seek to freeze Russian gold reserves,https://thehill.com/policy/finance/597332-senators-seek-to-freeze-russian-gold-reserves,https://news.ycombinator.com/item?id=30604938,tosh,2022-03-08T19:19:03,12.0
30599336,What the Syria war tells about Russia's use of humanitarian corridors,https://www.npr.org/2022/03/08/1085097957/what-the-war-in-syria-tells-about-russias-use-of-humanitarian-corridors,https://news.ycombinator.com/item?id=30599336,mudro_zboris,2022-03-08T12:54:12,12.0
30782928,Russia Bans Google News,https://twitter.com/KyivIndependent/status/1506727426600144896,https://news.ycombinator.com/item?id=30782928,jacquesm,2022-03-23T20:29:27,12.0
30618717,Children buried in rubble after Russian airstrike on Mariupol hospital,https://www.theguardian.com/world/live/2022/mar/09/ukraine-news-russia-war-ceasefire-broken-humanitarian-corridors-kyiv-russian-invasion-live-vladimir-putin-volodymyr-zelenskiy-latest-updates,https://news.ycombinator.com/item?id=30618717,squarefoot,2022-03-09T19:11:26,12.0
30605143,Russia May Use Antiquated An-2 Biplanes to 'Draw Out' Ukrainian Air Defenses,https://theaviationist.com/2022/03/02/russia-may-use-an-2-biplanes-in-ukraine/,https://news.ycombinator.com/item?id=30605143,georgecmu,2022-03-08T19:27:59,12.0
30617487,Lessors face legal quagmire as Russian plane repos stall,https://www.reuters.com/markets/europe/lessors-face-legal-quagmire-russian-plane-repos-stall-2022-03-09/,https://news.ycombinator.com/item?id=30617487,mhandley,2022-03-09T17:34:39,12.0
30625289,EU unveils plan to end reliance on Russian gas,https://www.bbc.co.uk/news/science-environment-60664799,https://news.ycombinator.com/item?id=30625289,open-source-ux,2022-03-10T10:25:10,12.0
30796929,"Israel blocked Ukraine from buying Pegasus spyware, fearing Russia’s anger",https://www.theguardian.com/world/2022/mar/23/israel-ukraine-pegasus-spyware-russia,https://news.ycombinator.com/item?id=30796929,SquibblesRedux,2022-03-24T23:38:31,12.0
30598253,Russian military communications intercepted after they destroyed 4G towers,https://www.rawstory.com/russia-ukraine-war/,https://news.ycombinator.com/item?id=30598253,Mo3,2022-03-08T09:53:48,12.0
30644666,Russia threatens to leave American astronaut in space,https://abc7news.com/russia-international-space-station-mark-vande-hei-iss-american-astronaut/11639556/,https://news.ycombinator.com/item?id=30644666,georgecmu,2022-03-11T19:14:46,12.0
30651715,"Russian Official Warns Finland, Sweden Against Joining NATO",https://www.bloomberg.com/news/articles/2022-03-12/russian-official-warns-finland-sweden-against-joining-nato,https://news.ycombinator.com/item?id=30651715,_Microft,2022-03-12T14:46:45,12.0
30648963,A top Wikipedia editor has been arrested in Belarus,https://www.theverge.com/2022/3/11/22973293/wikipedia-editor-russia-belarus-ukraine,https://news.ycombinator.com/item?id=30648963,buitreVirtual,2022-03-12T04:19:36,12.0
30785428,Russia Has Already Lost,https://www.thedrive.com/the-war-zone/44592/russia-has-already-lost,https://news.ycombinator.com/item?id=30785428,optimalsolver,2022-03-24T01:08:17,12.0
30704893,Putin: “A Natural and Necessary Self-Purification of Society”,https://twitter.com/ianbremmer/status/1504197845204840454,https://news.ycombinator.com/item?id=30704893,awb,2022-03-16T22:23:48,12.0
30606963,"Don't Block Russians, Inform Them",https://www.zdziarski.com/blog/?p=10995,https://news.ycombinator.com/item?id=30606963,jzdziarski,2022-03-08T21:07:01,12.0
30751833,The Most Famous Mathematicians from Ukraine,https://pantheon.world/profile/occupation/mathematician/country/ukraine,https://news.ycombinator.com/item?id=30751833,RafelMri,2022-03-21T08:59:43,12.0
30823931,"China's Sinopec Bows Out of Russian Petchem, Gas Projects",https://oilprice.com/Latest-Energy-News/World-News/Chinas-Sinopec-Bows-Out-Of-Russian-Petchem-Gas-Projects.html,https://news.ycombinator.com/item?id=30823931,rossdavidh,2022-03-27T20:44:35,12.0
30824691,How sanctions are killing Russia,https://twitter.com/kamilkazani/status/1507819508609679364,https://news.ycombinator.com/item?id=30824691,ta20200202,2022-03-27T22:15:11,12.0
30631827,Disney to pause all business in Russia,https://www.reuters.com/business/disney-pause-all-business-russia-2022-03-10/,https://news.ycombinator.com/item?id=30631827,mudro_zboris,2022-03-10T20:13:08,12.0
30608978,Twitter Launches Tor Onion Service Making Site Easier to Access in Russia,https://www.vice.com/en/article/v7dqxd/twitter-tor-onion-service-dark-web-version,https://news.ycombinator.com/item?id=30608978,arkadiyt,2022-03-08T23:44:16,12.0
30638558,Facebook to allow calls for violence against Putin,https://www.bbc.com/news/technology-60702619,https://news.ycombinator.com/item?id=30638558,pseudolus,2022-03-11T11:14:37,11.0
30705966,"As Russian Troop Deaths Climb, Morale Becomes an Issue, Officials Say",https://www.nytimes.com/2022/03/16/us/politics/russia-troop-deaths.html,https://news.ycombinator.com/item?id=30705966,duxup,2022-03-17T00:23:42,11.0
30663680,India Turning Its Back on Ukraine,https://www.theatlantic.com/ideas/archive/2022/03/india-military-support-russia-ukraine-war/627035/,https://news.ycombinator.com/item?id=30663680,DyslexicAtheist,2022-03-13T17:37:39,11.0
30640699,JetBrains’ Statement on Ukraine News,https://blog.jetbrains.com/blog/2022/03/11/jetbrains-statement-on-ukraine/?s=09,https://news.ycombinator.com/item?id=30640699,jerrygoyal,2022-03-11T14:59:15,11.0
30654982,A top Wikipedia editor has been arrested in Belarus,https://www.theverge.com/2022/3/11/22973293/wikipedia-editor-russia-belarus-ukraine,https://news.ycombinator.com/item?id=30654982,Tomte,2022-03-12T21:20:51,11.0
30654309,Ukrainians Win the Long War,https://lite.cnn.com/en/article/h_92b8577f8a8067e5a7563d3910229ecb,https://news.ycombinator.com/item?id=30654309,rntn,2022-03-12T19:50:42,11.0
30735558,Why India isn’t denouncing Russia’s Ukraine war,https://www.vox.com/22982698/india-russia-ukraine-war-putin-modi,https://news.ycombinator.com/item?id=30735558,amardeep,2022-03-19T17:14:53,11.0
30739349,Vladimir Putin Has Fallen into the Dictator Trap,https://www.theatlantic.com/ideas/archive/2022/03/putin-dictator-trap-russia-ukraine/627064/,https://news.ycombinator.com/item?id=30739349,mizzao,2022-03-20T02:02:26,11.0
30613620,Chornobyl disconnected from power following Russian attack,https://twitter.com/KyivIndependent/status/1501530325985472512,https://news.ycombinator.com/item?id=30613620,thesumofall,2022-03-09T12:15:51,11.0
30601647,United Nations advises staff against using ‘war’ or ‘invasion’ regarding Ukraine,https://www.irishtimes.com/news/world/united-nations-advises-staff-against-using-war-or-invasion-regarding-ukraine-1.4821438,https://news.ycombinator.com/item?id=30601647,georgecmu,2022-03-08T16:19:57,11.0
30645693,Russia releases secret footage of 1961 Tsar Bomba hydrogen blast (2020),https://www.youtube.com/watch?v=YtCTzbh4mNQ,https://news.ycombinator.com/item?id=30645693,cols,2022-03-11T20:37:59,11.0
30614130,Dutch internet providers block six Russian media websites,https://www.reuters.com/article/ukraine-crisis-netherlands-websites-idUKS8N2UM035,https://news.ycombinator.com/item?id=30614130,lb_,2022-03-09T13:24:26,11.0
30753603,Activists are targeting Russians with open-source “protestware”,https://www.technologyreview.com/2022/03/21/1047489/activists-are-targeting-russians-with-open-source-protestware/,https://news.ycombinator.com/item?id=30753603,22222,2022-03-21T13:02:21,11.0
30606376,Amazon Web Services blocks new sign-ups from Russia and Belarus,https://www.nytimes.com/2022/03/08/technology/amazon-web-services-russia.html,https://news.ycombinator.com/item?id=30606376,mudro_zboris,2022-03-08T20:25:44,11.0
30671437,India Is Mulling Rupee-Ruble Payments System for Trade with Russia,https://www.nakedcapitalism.com/2022/03/india-is-mulling-rupee-ruble-payments-system-for-trade-for-trade-with-russia.html,https://news.ycombinator.com/item?id=30671437,walterbell,2022-03-14T12:09:57,11.0
30785630,Ukraine Unplugged from Russia and Joined Europe’s Power Grid with Speed,https://www.scientificamerican.com/article/how-ukraine-unplugged-from-russia-and-joined-europes-power-grid-with-unprecedented-speed/,https://news.ycombinator.com/item?id=30785630,sohkamyung,2022-03-24T01:44:41,11.0
30613032,US rejects Poland’s offer to send MiG-29 fighter jets to Ukraine,https://www.aljazeera.com/news/2022/3/9/us-rejects-poland-offer-to-send-mig-29-fighter-jets-to-ukraine,https://news.ycombinator.com/item?id=30613032,sschueller,2022-03-09T10:37:21,11.0
30631406,Ukraine Post #2: Options,https://thezvi.wordpress.com/2022/03/10/ukraine-post-2-options/,https://news.ycombinator.com/item?id=30631406,abecedarius,2022-03-10T19:37:03,11.0
30632855,Russian propaganda divides families over Ukraine war,https://www.cnn.com/videos/world/2022/03/09/russia-propaganda-ukraine-war-vladimir-putin-newday-vpx.cnn,https://news.ycombinator.com/item?id=30632855,onemoresoop,2022-03-10T21:41:29,11.0
30675112,Hackers in Belarus are complicating Putin’s Ukraine invasion,https://www.fastcompany.com/90730789/cyber-partisans-hacking-belarus-putin-ukraine-invasion,https://news.ycombinator.com/item?id=30675112,pastalex,2022-03-14T17:16:28,11.0
30633941,Russia plans to seize assets of western companies exiting country,https://www.theguardian.com/world/2022/mar/10/russia-plans-to-seize-assets-of-western-companies-exiting-country,https://news.ycombinator.com/item?id=30633941,cmurf,2022-03-10T23:15:42,11.0
30627677,Ukrainian woman carried her old dog for 17km to cross the border with her,https://old.reddit.com/r/aww/comments/taodtv/this_ukrainian_woman_carried_her_old_dog_for_17km/,https://news.ycombinator.com/item?id=30627677,eveningcoffee,2022-03-10T15:04:48,11.0
