id,title,link,comments,user,timestamp,score
30578125,"Moscow police officers stop people, request their phones to read their messages",https://twitter.com/KevinRothrock/status/1500458582902460420,https://news.ycombinator.com/item?id=30578125,mudro_zboris,2022-03-06T15:23:57,684.0
30627892,DuckDuckGo “down-rank sites associated with Russian disinformation”,https://twitter.com/yegg/status/1501716484761997318,https://news.ycombinator.com/item?id=30627892,thallium205,2022-03-10T15:22:34,570.0
30586211,Russia to legalize software piracy,https://writing.kemitchell.com/2022/03/05/Russia-to-Legalize-Software-Piracy.html,https://news.ycombinator.com/item?id=30586211,Ambolia,2022-03-07T10:41:26,526.0
30728110,How Putin’s Oligarchs Bought London,https://www.newyorker.com/magazine/2022/03/28/how-putins-oligarchs-bought-london,https://news.ycombinator.com/item?id=30728110,null_object,2022-03-18T22:02:40,443.0
30614251,China's state media buys Meta ads pushing Russia's line on war,https://www.axios.com/chinas-state-media-meta-facebook-ads-russia-623763df-c5fb-46e4-a6a8-36b607e1b672.html,https://news.ycombinator.com/item?id=30614251,sofixa,2022-03-09T13:37:26,438.0
30697932,Zelensky video deepfake,https://news.ycombinator.com/item?id=30697932,https://news.ycombinator.com/item?id=30697932,osynavets,2022-03-16T12:30:11,398.0
30630666,820GB Database Dump of Roskomnadzor (Russian Government Censorship Organization),https://ddosecrets.substack.com/p/release-roskomnadzor-820-gb,https://news.ycombinator.com/item?id=30630666,chockchocschoir,2022-03-10T18:39:52,323.0
30602031,Red Hat is discontinuing sales and services in Russia and Belarus,https://www.redhat.com/en/blog/red-hats-response-war-ukraine,https://news.ycombinator.com/item?id=30602031,toppy,2022-03-08T16:45:17,248.0
30588689,"Latvia wants permanent U.S. troops, foreign minister tells Blinken",https://www.reuters.com/world/latvia-wants-permanent-us-troops-foreign-minister-tells-blinken-2022-03-07/,https://news.ycombinator.com/item?id=30588689,mudro_zboris,2022-03-07T15:11:03,224.0
30678304,Putin’s State Media News Is Interrupted: ‘They’re Lying to You’,https://www.bloomberg.com/news/articles/2022-03-14/putin-s-state-media-news-is-interrupted-they-re-lying-to-you,https://news.ycombinator.com/item?id=30678304,virtualwhys,2022-03-14T21:05:35,223.0
30645967,Inside Putin's Circle,https://www.ft.com/content/503fb110-f91e-4bed-b6dc-0d09582dd007,https://news.ycombinator.com/item?id=30645967,mayiplease,2022-03-11T21:01:55,212.0
30601767,Prediction that Kyiv falls to Russian forces by April 2022 goes from 90% to 26%,https://www.metaculus.com/questions/9939/kyiv-to-fall-to-russian-forces-by-april-2022/,https://news.ycombinator.com/item?id=30601767,torts,2022-03-08T16:27:24,205.0
30578448,Putin signs law to seize funds of officials that exceed declared income by $100,https://then24.com/2022/03/06/putin-signed-a-decree-on-the-confiscation-of-illegal-funds-of-officials/,https://news.ycombinator.com/item?id=30578448,awb,2022-03-06T16:05:07,205.0
30698632,Continental Europe successfully synced with Ukraine and Moldova power systems,https://www.entsoe.eu/news/2022/03/16/continental-europe-successful-synchronisation-with-ukraine-and-moldova-power-systems/,https://news.ycombinator.com/item?id=30698632,_Microft,2022-03-16T13:36:54,201.0
30640741,Russia opens criminal investigation of Meta over death calls on Facebook,https://www.reuters.com/world/kremlin-says-meta-would-have-cease-work-russia-if-reuters-report-is-true-2022-03-11/,https://news.ycombinator.com/item?id=30640741,LittleMoveBig,2022-03-11T15:03:02,198.0
30600491,"If you speak Russian, call Russia and tell them what is happening in Ukraine",https://callrussia.org/,https://news.ycombinator.com/item?id=30600491,harscoat,2022-03-08T14:50:52,197.0
30632695,Facebook and Instagram to temporarily allow calls for violence against Russians,https://www.reuters.com/world/europe/exclusive-facebook-instagram-temporarily-allow-calls-violence-against-russians-2022-03-10/,https://news.ycombinator.com/item?id=30632695,jmsflknr,2022-03-10T21:27:04,186.0
30598636,Japan has declared today that the southern Kurils is their sovereign territory,https://twitter.com/AlexandruC4/status/1500895234011680778,https://news.ycombinator.com/item?id=30598636,baxtr,2022-03-08T11:06:39,176.0
30755712,"3,599,040,600 € wired by Germany to Russia since the invasion of Ukraine",https://stopgas.org/en/,https://news.ycombinator.com/item?id=30755712,matthewmorgan,2022-03-21T16:07:45,168.0
30614163,Ukraine warns Chernobyl nuclear plant suffered power outage,https://www.axios.com/ukraine-chernobyl-nuclear-plant-power-russia-f47aff98-0e23-4b2a-8119-4bf025afb105.html,https://news.ycombinator.com/item?id=30614163,sofixa,2022-03-09T13:27:50,167.0
30652121,China markets in turmoil as Russia ties add to list of risks,https://www.bloombergquint.com/markets/china-s-markets-in-crisis-as-russia-ties-add-to-list-of-risks,https://news.ycombinator.com/item?id=30652121,mooreds,2022-03-12T15:46:30,154.0
30745931,After 600 hours 64 workers at Ukraine's Chernobyl nuclear plant finally relieved,https://tech.slashdot.org/story/22/03/20/1934212/after-about-600-hours-64-workers-at-chernobyl-nuclear-plant-finally-relieved,https://news.ycombinator.com/item?id=30745931,MilnerRoute,2022-03-20T19:44:34,145.0
30616924,Roskomsvoboda statement on foreign companies’ sanctions against Russians [pdf],https://github.com/e-oz/files/blob/main/statement_of_roskomsvoboda_team.pdf,https://news.ycombinator.com/item?id=30616924,EugeneOZ,2022-03-09T17:03:53,143.0
30639572,JetBrains suspends R&D activities in Russia and sales in Russia and Belarus,https://blog.jetbrains.com/blog/2022/03/11/jetbrains-statement-on-ukraine/,https://news.ycombinator.com/item?id=30639572,mrkwse,2022-03-11T13:27:42,136.0
30656668,"In Moscow, McDonald's packs up, radio falls silent and the brain drain begins",https://lite.cnn.com/en/article/h_032d5311e117bcfd9144ac4c4360ab33,https://news.ycombinator.com/item?id=30656668,rntn,2022-03-13T00:40:44,130.0
30648360,Putin’s Worsening Problems,https://newlinesmag.com/argument/putins-worsening-problems/,https://news.ycombinator.com/item?id=30648360,guildwriter,2022-03-12T02:13:12,121.0
30579406,War in Ukraine: Marshall Mud is winning again,https://eclecticlight.co/2022/03/06/war-in-ukraine-marshall-mud-is-winning-again/,https://news.ycombinator.com/item?id=30579406,mrzool,2022-03-06T17:54:01,121.0
30736834,Ivan Krastev on Russia's Invasion of Ukraine,https://www.spiegel.de/international/world/ivan-krastev-on-russia-s-invasion-of-ukraine-putin-lives-in-historic-analogies-and-metaphors-a-1d043090-1111-4829-be90-c20fd5786288,https://news.ycombinator.com/item?id=30736834,ivank,2022-03-19T19:26:05,120.0
30612728,China to provide 5 mln yuan worth of humanitarian assistance to Ukraine,https://www.reuters.com/world/china-provide-5-mln-yuan-worth-humanitarian-assistance-ukraine-2022-03-09/,https://news.ycombinator.com/item?id=30612728,limoce,2022-03-09T09:53:39,111.0
30655961,Jailed Navalny calls for anti-war protests across Russia on Sunday,https://www.reuters.com/world/europe/kremlin-critic-navalny-calls-anti-war-protests-across-russia-2022-03-11/,https://news.ycombinator.com/item?id=30655961,awb,2022-03-12T23:15:14,111.0
30604374,Statement from Poland on providing airplanes to Ukraine,https://www.gov.pl/web/diplomacy/statement-of-the-minister-of-foreign-affairs-of-the-republic-of-poland-in-connection-with-the-statement-by-the-us-secretary-of-state-on-providing-airplanes-to-ukraine,https://news.ycombinator.com/item?id=30604374,ceejayoz,2022-03-08T18:56:42,103.0
30590957,China-Russia trade has surged as countries grow closer,https://www.reuters.com/markets/europe/china-russia-trade-has-surged-countries-grow-closer-2022-03-01/,https://news.ycombinator.com/item?id=30590957,sereja,2022-03-07T17:47:46,98.0
30654381,Kremlin arrests FSB chiefs in fallout from Ukraine chaos,https://www.thetimes.co.uk/article/kremlin-arrests-fsb-chiefs-in-fallout-from-ukraine-invasion-chaos-92w0829c5,https://news.ycombinator.com/item?id=30654381,arkadiyt,2022-03-12T19:58:56,94.0
30696998,Norwegian developer job board for Ukrainian refugees,https://www.kode24.no/tech-jobs-norway,https://news.ycombinator.com/item?id=30696998,retrojorgen,2022-03-16T10:04:01,93.0
30668904,The curious case of Russia's missing Air Force,https://www.economist.com/interactive/2022/03/08/curious-case-russias-missing-air-force,https://news.ycombinator.com/item?id=30668904,cols,2022-03-14T05:44:34,92.0
30606773,The Coca-Cola Company Suspends Its Business in Russia,https://www.coca-colacompany.com/press-releases/coca-cola-company-suspends-business-russia,https://news.ycombinator.com/item?id=30606773,mudro_zboris,2022-03-08T20:53:24,85.0
30631731,Russia Preparing for MitM,https://groups.google.com/a/mozilla.org/g/dev-security-policy/c/QaKxfr5hOXg,https://news.ycombinator.com/item?id=30631731,arkadiyt,2022-03-10T20:04:37,83.0
30580767,Open Letter to Visa and Mastercard from IT Specialists Fleeing Russia,https://news.ycombinator.com/item?id=30580767,https://news.ycombinator.com/item?id=30580767,smugglerFlynn,2022-03-06T20:10:18,81.0
30578017,Russian banks rush to switch to Chinese card system,https://www.reuters.com/business/finance/russian-banks-rush-switch-chinese-card-system-2022-03-06/,https://news.ycombinator.com/item?id=30578017,LittleMoveBig,2022-03-06T15:09:12,77.0
30736783,Russian cosmonauts arrive at ISS in colours of Ukraine flag,https://www.thetimes.co.uk/article/cosmonauts-arrive-at-iss-in-colours-of-ukraine-flag-6rwcltmjt,https://news.ycombinator.com/item?id=30736783,leephillips,2022-03-19T19:18:21,76.0
30585927,Calling all pirates: This US lawmaker wants you to seize Russian vessels,https://www.militarytimes.com/off-duty/military-culture/2022/03/02/calling-all-pirates-this-us-lawmaker-wants-you-to-seize-russian-vessels/,https://news.ycombinator.com/item?id=30585927,hdivider,2022-03-07T09:52:49,75.0
30754746,A Moscow court has banned Facebook and Instagram as “extremist” organizations,https://twitter.com/MoscowTimes/status/1505914095274450949,https://news.ycombinator.com/item?id=30754746,nixass,2022-03-21T14:48:14,73.0
30672676,"India considers buying discounted Russian oil, commodities",https://www.reuters.com/world/india/india-considers-buying-discounted-russian-oil-commodities-officials-say-2022-03-14/,https://news.ycombinator.com/item?id=30672676,prostoalex,2022-03-14T14:14:22,72.0
30582159,Russia forcing all businesses to relocate away from Internet in 5 days,https://twitter.com/krisnova/status/1500590809585893378,https://news.ycombinator.com/item?id=30582159,miohtama,2022-03-06T23:02:31,71.0
30601991,Swedish PM rejects opposition calls to consider joining NATO,https://www.reuters.com/world/europe/applying-join-nato-would-destabilize-security-situation-swedish-pm-says-2022-03-08/,https://news.ycombinator.com/item?id=30601991,mudro_zboris,2022-03-08T16:42:41,70.0
30670545,Mapping and Seizing the Oligarchs' Assets,https://googlemapsmania.blogspot.com/2022/03/mapping-oligarchs-assets.html,https://news.ycombinator.com/item?id=30670545,chippy,2022-03-14T10:14:43,69.0
30640611,"China censors online Ukraine debate, bars calls for peace",https://www.reuters.com/business/media-telecom/china-censors-online-ukraine-debate-bars-calls-peace-2022-03-10/,https://news.ycombinator.com/item?id=30640611,JumpCrisscross,2022-03-11T14:53:40,68.0
30652223,Russia’s Invasion of Ukraine Is Redrawing the Geopolitics of Space - ISS,https://www.nature.com/articles/d41586-022-00727-x,https://news.ycombinator.com/item?id=30652223,News-Dog,2022-03-12T15:58:22,68.0
30577847,Pope Francis says Ukraine conflict is not a 'military operation but a war',https://www.reuters.com/world/europe/pope-francis-says-ukraine-conflict-is-not-military-operation-war-2022-03-06/,https://news.ycombinator.com/item?id=30577847,mudro_zboris,2022-03-06T14:41:42,66.0
30760594,Russians Are Racing to Download Wikipedia Before It Gets Banned,https://slate.com/technology/2022/03/russia-wikipedia-download-kiwix.html,https://news.ycombinator.com/item?id=30760594,danso,2022-03-21T22:31:08,65.0
30684576,Russian tanks in Ukraine are sprouting cages,https://www.economist.com/science-and-technology/russian-tanks-in-ukraine-are-sprouting-cages/21808191,https://news.ycombinator.com/item?id=30684576,acqbu,2022-03-15T12:48:00,64.0
30656842,Was China Betting on Russian Defeat All Along?,https://www.geopoliticalmonitor.com/was-china-betting-on-russian-defeat-all-along/,https://news.ycombinator.com/item?id=30656842,geox,2022-03-13T01:10:57,64.0
30770112,Maersk to completely leave Russia and sell its Russian assets,https://trans.info/en/russia-maersk-281292,https://news.ycombinator.com/item?id=30770112,CharlesW,2022-03-22T19:05:28,63.0
30628332,"Vladimir Putin is pushing Russia into past: Maybe a generation, maybe a century",https://www.economist.com/briefing/2022/03/12/vladimir-putin-is-pushing-russia-into-the-past,https://news.ycombinator.com/item?id=30628332,CapitalistCartr,2022-03-10T15:56:07,62.0
30716670,"Pro-Ukraine ‘Protestware’ Pushes Antiwar Ads, Geo-Targeted Malware",https://krebsonsecurity.com/2022/03/pro-ukraine-protestware-pushes-antiwar-ads-geo-targeted-malware/,https://news.ycombinator.com/item?id=30716670,todsacerdoti,2022-03-17T22:40:58,61.0
30641122,Ukraine says Russia fired at Belarus from Ukrainian airspace to drag it into war,https://www.reuters.com/world/ukraine-says-russian-aircraft-fired-belarus-ukrainian-air-space-2022-03-11/,https://news.ycombinator.com/item?id=30641122,mudro_zboris,2022-03-11T15:35:07,59.0
30786069,The Russians Are Coming,https://writing.kemitchell.com/2022/03/23/The-Russians-Are-Coming.html,https://news.ycombinator.com/item?id=30786069,mplanchard,2022-03-24T03:18:18,58.0
30658688,Possible Outcomes of the Russo-Ukrainian War and China’s Choice,https://uscnpm.org/2022/03/12/hu-wei-russia-ukraine-war-china-choice/,https://news.ycombinator.com/item?id=30658688,guard0g,2022-03-13T06:59:44,58.0
30632252,"Russia, Belarus squarely in 'default territory' on billions in debt -World Bank",https://www.reuters.com/markets/europe/russia-belarus-squarely-default-territory-billions-debt-world-bank-2022-03-09/,https://news.ycombinator.com/item?id=30632252,paulpauper,2022-03-10T20:50:11,58.0
30808316,Anonymous Publishes Leak of the Central Bank of the Russian Federation,https://twitter.com/LatestAnonPress/status/1507477329689387008,https://news.ycombinator.com/item?id=30808316,prostoalex,2022-03-26T00:44:35,57.0
30575992,Tell HN: Google removes Russian news from results,https://news.ycombinator.com/item?id=30575992,https://news.ycombinator.com/item?id=30575992,supergirl,2022-03-06T08:29:51,57.0
30741054,Epic Games to donate all Fortnite proceeds for 2 weeks to Ukraine relief,https://www.epicgames.com/fortnite/en-US/news/support-humanitarian-relief-for-ukraine,https://news.ycombinator.com/item?id=30741054,t3rabytes,2022-03-20T08:23:48,56.0
30632894,Russia is abandoning SSL certs in favor of their own,https://www.cnews.ru/news/top/2022-03-10_rossiyan_srochno_perevodyat,https://news.ycombinator.com/item?id=30632894,ct0,2022-03-10T21:45:06,55.0
30662899,What the Russian Invasion Has Done to Ukraine,https://www.newyorker.com/magazine/2022/03/21/what-the-russian-invasion-has-done-to-ukraine,https://news.ycombinator.com/item?id=30662899,Brajeshwar,2022-03-13T16:36:28,54.0
30682117,"So, Beijing Has a Nuclear Pact with Ukraine",https://www.chinadiction.com/p/so-beijing-has-a-nuclear-pact-with,https://news.ycombinator.com/item?id=30682117,herendin2,2022-03-15T06:07:53,53.0
30584671,Tell HN: Zelensky is blurring -not blanking- sensitive info in a video with Musk,https://news.ycombinator.com/item?id=30584671,https://news.ycombinator.com/item?id=30584671,giuliomagnifico,2022-03-07T06:10:40,52.0
30670865,Russian Ingress players create a dove of peace over Moscow,https://community.ingress.com/en/discussion/18582/the-dove-of-peace-march-9-2022,https://news.ycombinator.com/item?id=30670865,chippy,2022-03-14T11:01:12,52.0
30629658,Bug 1758773: MITM in Russia,https://bugzilla.mozilla.org/show_bug.cgi?id=1758773,https://news.ycombinator.com/item?id=30629658,lalaland1125,2022-03-10T17:30:29,51.0
30628096,Moscow retaliates against Western sanctions with export bans,https://www.reuters.com/business/russia-suspends-exports-tech-telecoms-medical-auto-agricultural-equipment-until-2022-03-10/,https://news.ycombinator.com/item?id=30628096,mudro_zboris,2022-03-10T15:38:45,50.0
30595219,Ukrainian Numbers Stations S06s and E17z Go Silent,https://www.numbers-stations.com/ukrainian-numbers-stations-go-silent/,https://news.ycombinator.com/item?id=30595219,ptcrash,2022-03-08T00:43:56,50.0
30763591,Ukrainian scientists rush to save irreplaceable collections,https://www.science.org/content/article/you-can-t-get-back-specimens-ukrainian-scientists-rush-save-irreplaceable-collections,https://news.ycombinator.com/item?id=30763591,bschne,2022-03-22T07:48:30,50.0
30656340,"Ballistic missiles hit Iraq's Kurdish capital, no casualties – officials",https://www.reuters.com/world/middle-east/multiple-rockets-fall-erbil-northern-iraq-state-media-2022-03-12/,https://news.ycombinator.com/item?id=30656340,awb,2022-03-12T23:55:20,49.0
30603030,Russia Turns to Chinese Currency,https://www.axios.com/russia-turns-renminbi-yuan-3900baa9-f7b5-41f0-a1a3-80e2b9c30170.html,https://news.ycombinator.com/item?id=30603030,geox,2022-03-08T17:48:54,48.0
30624320,Users upset DuckDuckGo down-ranks sites associated with Russian disinformation,https://twitter.com/yegg/status/1501716484761997318,https://news.ycombinator.com/item?id=30624320,username3,2022-03-10T07:55:19,48.0
30710136,Escaping Putin,https://www.spiegel.de/international/world/the-opposition-flee-from-russia-they-leave-knowing-they-are-cursed-everywhere-a-cceca3e5-a922-495d-a922-2b1cc5a228c4,https://news.ycombinator.com/item?id=30710136,RickJWagner,2022-03-17T11:57:30,47.0
30728408,Specialist Ukrainian drone unit picks off invading Russian forces,https://www.thetimes.co.uk/article/specialist-drone-unit-picks-off-invading-forces-as-they-sleep-zlx3dj7bb,https://news.ycombinator.com/item?id=30728408,dfsegoat,2022-03-18T22:31:51,46.0
30678400,"Hi, I’m Russian. The West doesn’t realize the good and the bad news about Russia",https://procedural.medium.com/hi-im-russian-the-western-world-doesn-t-realize-the-good-news-and-the-bad-news-about-russia-f6fd9bc1be02,https://news.ycombinator.com/item?id=30678400,Procedural,2022-03-14T21:12:16,45.0
30645372,Congressmen Used Insider Knowledge to Profit from War in Ukraine,https://themountain.news/news/congressmen-used-insider-knowledge-to-profit-from-war-in-ukraine,https://news.ycombinator.com/item?id=30645372,mamama3,2022-03-11T20:09:38,45.0
30648748,What’s Happening in Russia/Moscow right now,https://twitter.com/killa_ru/status/1502075252989382664,https://news.ycombinator.com/item?id=30648748,sandinmyjoints,2022-03-12T03:27:27,45.0
30707728,CVE-2022-23812: node-ipc contains malicious code targeting Russia and Belarus,https://nvd.nist.gov/vuln/detail/CVE-2022-23812,https://news.ycombinator.com/item?id=30707728,lvass,2022-03-17T04:40:19,44.0
30584410,"Steps we've taken around Cloudflare's services in Ukraine, Belarus, and Russia",https://blog.cloudflare.com/steps-taken-around-cloudflares-services-in-ukraine-belarus-and-russia/,https://news.ycombinator.com/item?id=30584410,decrypt,2022-03-07T05:05:29,44.0
30755288,Putin’s War Is a Death Blow to Nuclear Nonproliferation,https://foreignpolicy.com/2022/03/21/nuclear-weapons-war-russia-ukraine-putin-nonproliferation-treaty-npt/,https://news.ycombinator.com/item?id=30755288,adventured,2022-03-21T15:37:29,43.0
30665459,"Hi, I’m Russian. Ukraine and Russia is a story of a divorce",https://procedural.medium.com/hi-im-russian-ukraine-and-russia-is-a-story-of-a-divorce-221db815e930,https://news.ycombinator.com/item?id=30665459,Procedural,2022-03-13T20:38:00,43.0
30592117,"Coinbase blocks 25,000 crypto wallets linked to Russia users",https://www.bloombergquint.com/onweb/coinbase-blocks-25-000-crypto-wallets-linked-to-russian-users,https://news.ycombinator.com/item?id=30592117,geox,2022-03-07T19:18:20,42.0
30652702,Amsterdam Russian Orthodox Church Leaves Moscow Church for Constantinople,https://www.paudal.com/2022/03/12/russian-orthodox-clergy-in-amsterdam-leave-moscow-church/,https://news.ycombinator.com/item?id=30652702,28304283409234,2022-03-12T16:55:46,41.0
30704148,Russia bombs theater where hundreds sheltered and 'children' written on grounds,https://www.cnn.com/2022/03/16/europe/ukraine-mariupol-bombing-theater-intl/index.html,https://news.ycombinator.com/item?id=30704148,trhway,2022-03-16T21:10:54,41.0
30638483,M-427 Russian online/offline encryption device reportedly seized in Ukraine,https://www.cryptomuseum.com/crypto/ru/m427/,https://news.ycombinator.com/item?id=30638483,ilamont,2022-03-11T10:59:12,41.0
30606637,McDonald's to temporarilly close all 847 restaurants in Russia,https://www.reuters.com/business/retail-consumer/mcdonalds-close-restaurants-russia-2022-03-08/,https://news.ycombinator.com/item?id=30606637,quadcore,2022-03-08T20:45:39,40.0
30641005,Russia's attack on Ukraine halts half of world's neon output for chips,https://www.reuters.com/technology/exclusive-ukraine-halts-half-worlds-neon-output-chips-clouding-outlook-2022-03-11/,https://news.ycombinator.com/item?id=30641005,lsllc,2022-03-11T15:24:53,40.0
30621858,Putin’s Strategic Error,https://www.theatlantic.com/international/archive/2022/03/putin-nato-finland-sweden-support-ukraine/626965/,https://news.ycombinator.com/item?id=30621858,gamechangr,2022-03-10T00:36:12,40.0
30639749,Drone downed in Zagreb is not Ukrainian – adviser to defense minister,https://ua.interfax.com.ua/news/general/811513.html,https://news.ycombinator.com/item?id=30639749,mudro_zboris,2022-03-11T13:42:38,40.0
30609961,Fitch says default 'imminent' on Russian debt,https://www.reuters.com/markets/europe/fitch-cuts-russias-rating-says-debt-default-imminent-2022-03-08/,https://news.ycombinator.com/item?id=30609961,novateg,2022-03-09T01:30:57,39.0
30714429,Anonymous has hacked Russian CCTV and published the feeds online,https://behindenemylines.live/,https://news.ycombinator.com/item?id=30714429,simonswords82,2022-03-17T18:35:23,39.0
30655516,Ask HN: Which VPN provider should one use from Russia?,https://news.ycombinator.com/item?id=30655516,https://news.ycombinator.com/item?id=30655516,faebi,2022-03-12T22:20:42,39.0
30695453,Tell HN: Mailchimp locked my account because I'm Russian,https://news.ycombinator.com/item?id=30695453,https://news.ycombinator.com/item?id=30695453,f311a,2022-03-16T04:51:20,39.0
30739996,Manhattan’s Chinese Street Signs Are Disappearing,https://www.nytimes.com/interactive/2022/03/11/nyregion/nyc-chinatown-signs.html,https://news.ycombinator.com/item?id=30739996,apollinaire,2022-03-20T04:03:47,39.0
30639245,"Ask HN: Don't you think, revoking SSL cert for some Russian banks was too much?",https://news.ycombinator.com/item?id=30639245,https://news.ycombinator.com/item?id=30639245,eimrine,2022-03-11T12:58:48,39.0
30615132,Russian military's encrypted phones intercepted after destroying 3G/4G towers,https://www.datacenterdynamics.com/en/news/ukraine-russian-militarys-own-encrypted-phones-impacted-after-destroying-3g4g-towers-allowing-comms-to-be-intercepted/,https://news.ycombinator.com/item?id=30615132,timthorn,2022-03-09T15:02:31,38.0
30621178,Silicon Valley tech worker was the Ukrainian mom lying dead on street in photo,https://www.sfchronicle.com/california/article/Silicon-Valley-tech-worker-was-the-Ukrainian-mom-16990037.php,https://news.ycombinator.com/item?id=30621178,belltaco,2022-03-09T23:06:47,38.0
30631796,DJI limits “Aeroscope” for the Ukrainian Army but not for the Russian Army,https://twitter.com/vshymanskyy/status/1501966844118372356,https://news.ycombinator.com/item?id=30631796,keewee7,2022-03-10T20:11:01,37.0
30684379,Russia deploys a mystery munition in Ukraine,https://www.nytimes.com/2022/03/14/us/russia-ukraine-weapons-decoy.html,https://news.ycombinator.com/item?id=30684379,mhb,2022-03-15T12:19:58,37.0
30706602,Popular NPM module node-ipc added malware targeting Russian developers,https://gist.github.com/MidSpike/f7ae3457420af78a54b38a31cc0c809c,https://news.ycombinator.com/item?id=30706602,zimmund,2022-03-17T01:46:09,37.0
30658732,Russian attack on Zaporizhzhia nuclear plant more dangerous than first thought,https://www.npr.org/2022/03/11/1085427380/ukraine-nuclear-power-plant-zaporizhzhia,https://news.ycombinator.com/item?id=30658732,perihelions,2022-03-13T07:07:09,36.0
30665106,Russia asks China for military assistance in its invasion of Ukraine,https://www.ft.com/content/30850470-8c8c-4b53-aa39-01497064a7b7,https://news.ycombinator.com/item?id=30665106,labrador,2022-03-13T19:57:24,36.0
30642719,WHO advises Ukraine to destroy health lab pathogens to prevent disease spread,https://www.reuters.com/world/europe/exclusive-who-says-it-advised-ukraine-destroy-pathogens-health-labs-prevent-2022-03-11/,https://news.ycombinator.com/item?id=30642719,Jimmc414,2022-03-11T17:12:34,35.0
30789106,War in Ukraine: How I Kept Coding Under Missile Attacks,https://alexpavlov.dev/how-i-kept-coding-under-missile-attacks/,https://news.ycombinator.com/item?id=30789106,AlexPavlov,2022-03-24T12:59:15,35.0
30813312,China forces Mozilla to remove adblockers from its store,https://twitter.com/lomomcat/status/1505836402256146435,https://news.ycombinator.com/item?id=30813312,ShowalkKama,2022-03-26T16:39:47,35.0
30742020,Vladimir Putin Has Fallen into the Dictator Trap,https://www.theatlantic.com/ideas/archive/2022/03/putin-dictator-trap-russia-ukraine/627064/,https://news.ycombinator.com/item?id=30742020,zqna,2022-03-20T12:16:01,34.0
