id,title,link,comments,user,timestamp,score
30693977,Saudi Arabia Considers Accepting Yuan Instead of Dollars for Chinese Oil Sales,https://www.wsj.com/articles/saudi-arabia-considers-accepting-yuan-instead-of-dollars-for-chinese-oil-sales-11647351541,https://news.ycombinator.com/item?id=30693977,csomar,2022-03-16T00:56:30,9.0
30665875,War in Ukraine: Uni to uniform – Ukraine's new teenage army recruits,https://www.bbc.com/news/world-europe-60724560,https://news.ycombinator.com/item?id=30665875,LittleMoveBig,2022-03-13T21:23:59,9.0
30650840,Russia's Richest Businessman tells Putin – 'Don't take us back to 1917',https://lite.cnn.com/en/article/h_5876ba406da6519b81731e410631ac92,https://news.ycombinator.com/item?id=30650840,News-Dog,2022-03-12T12:10:57,9.0
30760844,"Against all odds, Ukrainians are winning",https://www.washingtonpost.com/opinions/2022/03/21/ukraine-is-winning-war-russia-offensive-putin/,https://news.ycombinator.com/item?id=30760844,Victerius,2022-03-21T22:58:34,9.0
30608024,"Coinbase blocks access to over 25,000 Russian-owned cryptocurrency wallets",https://venturebeat.com/2022/03/07/coinbase-blocks-access-to-over-25000-russian-owned-cryptocurrency-wallets/,https://news.ycombinator.com/item?id=30608024,mmq,2022-03-08T22:19:55,9.0
30788818,BBC: 'Shame on you': How President Zelensky uses speeches to get what he needs,https://www.bbc.com/news/world-europe-60855280,https://news.ycombinator.com/item?id=30788818,acadapter,2022-03-24T12:23:24,9.0
30607598,McDonald's and Coca Cola halt business in Russia,https://www.bbc.co.uk/news/business-60665877,https://news.ycombinator.com/item?id=30607598,vinni2,2022-03-08T21:50:10,9.0
30627440,"Ukraine invasion: We should consider internet sanctions, says ICANN ex-CEO",https://www.theregister.com/2022/03/10/internet_russia_sanctions/,https://news.ycombinator.com/item?id=30627440,Dotnaught,2022-03-10T14:42:55,9.0
30612779,Ukraine war: Why has 'Z' become a Russian pro-war symbol?,https://www.bbc.co.uk/news/world-europe-60644832,https://news.ycombinator.com/item?id=30612779,vanilla-almond,2022-03-09T10:02:41,8.0
30667933,Prominent editor of Russian Wikipedia pages detained in Belarus,https://www.engadget.com/mark-bernstein-russian-wikipedia-pages-detained-in-belarus-104102452.html,https://news.ycombinator.com/item?id=30667933,electic,2022-03-14T02:29:36,8.0
30706836,Facebook removes ‘deepfake’ of Ukrainian President Zelenskyy,https://www.theverge.com/2022/3/16/22981806/facebook-removes-deepfake-ukraine-zelenskyy-meta-instagram,https://news.ycombinator.com/item?id=30706836,awb,2022-03-17T02:16:28,8.0
30677645,"Ukraine halts half of world's neon output for chips, clouding outlook",https://www.cnn.com/2022/03/11/tech/ukraine-neon-chips/index.html,https://news.ycombinator.com/item?id=30677645,swamp40,2022-03-14T20:14:38,8.0
30692232,Russia is spiraling toward a $150B default nightmare,https://stocks.apple.com/A4zeLUVf0Qp-h1SHmY5zmKw,https://news.ycombinator.com/item?id=30692232,awb,2022-03-15T21:47:40,8.0
30671372,Ukraine has started using Clearview AI’s facial recognition during war,https://www.reuters.com/article/ukraine-crisis-facial-recognition-idUSKCN2LA0JS,https://news.ycombinator.com/item?id=30671372,phrygian,2022-03-14T11:59:35,8.0
30665105,"Ukrainian drone startup, asking donation",https://uadynamics.com/,https://news.ycombinator.com/item?id=30665105,julienfr112,2022-03-13T19:57:15,8.0
30701018,"Interactive map of the war in Ukraine, visualizing incidents over time",https://observablehq.com/@oscarpas/ukraine-conflict-incidents-over-time,https://news.ycombinator.com/item?id=30701018,oscarpas,2022-03-16T16:39:19,8.0
30678835,Russian state customers may obtain right to use unlicensed software,https://interfax.com/newsroom/top-stories/76706/,https://news.ycombinator.com/item?id=30678835,nwellnhof,2022-03-14T21:47:45,8.0
30700498,Lego retailer raises $16K for Ukraine selling tiny Molotovs,https://www.brickfanatics.com/lego-retailer-raises-16k-selling-molotovs/,https://news.ycombinator.com/item?id=30700498,rbanffy,2022-03-16T16:02:11,8.0
30664902,American journalist Brent Renaud shot and killed by Russian forces in Ukraine,https://www.cbsnews.com/news/brent-renaud-ukraine-russia-american-journalist-killed/,https://news.ycombinator.com/item?id=30664902,green-eclipse,2022-03-13T19:35:12,8.0
30667239,Ask HN: How to Pay Russian Contractors?,https://news.ycombinator.com/item?id=30667239,https://news.ycombinator.com/item?id=30667239,readytoaskhn,2022-03-14T00:32:00,8.0
30705331,Video shows Russian tank firing on an apartment building in Ukraine,https://www.cnn.com/videos/world/2022/03/13/tank-apartment-building-ukraine-mariupol-vpx.cnn,https://news.ycombinator.com/item?id=30705331,WalterGR,2022-03-16T23:09:27,8.0
30676195,"China, Russia, and the Inflation Situation",https://noahpinion.substack.com/p/china-russia-and-the-inflation-situation,https://news.ycombinator.com/item?id=30676195,laurex,2022-03-14T18:33:34,8.0
30665825,Oracle has ended all operations in the Russian Federation,https://twitter.com/Oracle/status/1503104376298221582,https://news.ycombinator.com/item?id=30665825,nathan_phoenix,2022-03-13T21:19:17,8.0
30680448,Ash HN: Starlink for Ukrainian Military,https://news.ycombinator.com/item?id=30680448,https://news.ycombinator.com/item?id=30680448,marcino239,2022-03-15T00:46:20,8.0
30612813,How Western Elites Exploit Ukraine,https://unherd.com/2022/03/how-western-elites-exploit-ukraine/,https://news.ycombinator.com/item?id=30612813,yessirwhatever,2022-03-09T10:07:18,8.0
30636155,US official: Russian invasion of Ukraine risks release of deadly pathogens,https://thebulletin.org/2022/02/us-official-russian-invasion-of-ukraine-risks-release-of-dangerous-pathogens/,https://news.ycombinator.com/item?id=30636155,LittleMoveBig,2022-03-11T04:24:13,8.0
30619636,U.S. $13.6B Aid package for Ukraine,https://lite.cnn.com/en/article/h_6b1176c790fad05fe7d0a6f16776305b,https://news.ycombinator.com/item?id=30619636,News-Dog,2022-03-09T20:37:20,8.0
30640300,Facebook allows posts on Ukraine war calling for violence on some,https://www.cnn.com/2022/03/10/tech/facebook-instagram-russians/index.html,https://news.ycombinator.com/item?id=30640300,A4ET8a8uTh0,2022-03-11T14:27:08,8.0
30640057,Moscow to issue HTTPS certs to Russian websites,https://www.theregister.com/2022/03/11/russian_ca/,https://news.ycombinator.com/item?id=30640057,pat-jay,2022-03-11T14:08:27,8.0
30639786,The War in Ukraine Is Threatening the World's Wheat Supply,https://www.wired.com/story/the-war-in-ukraine-is-threatening-the-breadbasket-of-europe/,https://news.ycombinator.com/item?id=30639786,WithinReason,2022-03-11T13:45:10,8.0
30800791,Ukraine uses Clearview.ai facial recognition to identify killed Russian soldiers,https://www.theguardian.com/technology/2022/mar/24/ukraine-facial-recognition-identify-russian-soldiers,https://news.ycombinator.com/item?id=30800791,jasonhansel,2022-03-25T11:27:18,8.0
30762883,Ukraine’s President Is in over His Head,https://www.nytimes.com/2022/02/21/opinion/ukraine-russia-zelensky-putin.html,https://news.ycombinator.com/item?id=30762883,readonthegoapp,2022-03-22T05:00:49,8.0
30639306,Russia Just Created Its Own Certificate Authority,https://www.youtube.com/watch?v=vdnTbeGtxuQ,https://news.ycombinator.com/item?id=30639306,krthr,2022-03-11T13:05:16,8.0
30624737,IAEA resolution condemning Russian attacks on nuclear facilities in Ukraine [pdf],https://www.iaea.org/sites/default/files/22/03/gov-2022-17.pdf,https://news.ycombinator.com/item?id=30624737,torts,2022-03-10T08:54:14,8.0
30624826,Miscalculation and Myopia in Moscow: Understanding Russia’s Regime Change Folly,https://mwi.usma.edu/miscalculation-and-myopia-in-moscow-understanding-russias-regime-change-folly/,https://news.ycombinator.com/item?id=30624826,rbanffy,2022-03-10T09:07:41,8.0
30610306,A closer look at Russian army logistics (2021),https://warontherocks.com/2021/11/feeding-the-bear-a-closer-look-at-russian-army-logistics/,https://news.ycombinator.com/item?id=30610306,greesil,2022-03-09T02:32:51,8.0
30635650,Finnair Noticing GPS Abnormalities Near the Russian Border,https://simpleflying.com/finnair-gps-abnormalities-russian-border/,https://news.ycombinator.com/item?id=30635650,AceyMan,2022-03-11T03:08:42,8.0
30757974,Russia faces IT crisis with just two months of data storage left,https://www.bleepingcomputer.com/news/technology/russia-faces-it-crisis-with-just-two-months-of-data-storage-left/,https://news.ycombinator.com/item?id=30757974,woliveirajr,2022-03-21T18:38:13,8.0
30618436,CERN Suspends Collaborations with Russia,https://www.scientificamerican.com/article/cern-suspends-collaborations-with-russia/,https://news.ycombinator.com/item?id=30618436,0xedb,2022-03-09T18:46:31,8.0
30604928,Upwork Statement on the Invasion of Ukraine and Operations in Russia and Belarus,https://www.upwork.com/press/releases/statement-from-upwork-on-the-invasion-of-ukraine-and-operations-in-russia-and-belarus,https://news.ycombinator.com/item?id=30604928,Turukawa,2022-03-08T19:18:44,8.0
30633405,A tech executive is quietly funding hundreds of soldiers to fight for Ukraine,https://www.theverge.com/2022/3/9/22969195/ukraine-russia-reddit-discord-anthony-capone-volunteers-subreddit-veterans,https://news.ycombinator.com/item?id=30633405,unclebucknasty,2022-03-10T22:26:28,8.0
30793997,China Starts Up First Fourth-Generation Nuclear Reactor,https://www.powermag.com/china-starts-up-first-fourth-generation-nuclear-reactor/,https://news.ycombinator.com/item?id=30793997,PaulHoule,2022-03-24T18:58:13,8.0
30604140,McDonald’s to Shutter 850 Russia Stores After Rising Backlash,https://www.bloomberg.com/news/articles/2022-03-08/mcdonald-s-to-temporarily-close-its-850-russia-locations,https://news.ycombinator.com/item?id=30604140,ushakov,2022-03-08T18:48:22,8.0
30785070,Analyzed dozens of battlefield radio transmissions between Russians in Ukraine,https://twitter.com/trbrtc/status/1506739285227147268,https://news.ycombinator.com/item?id=30785070,vinnyglennon,2022-03-23T23:57:31,8.0
30619103,The curious case of Russia’s missing Air Force,https://www.economist.com/interactive/2022/03/08/curious-case-russias-missing-air-force,https://news.ycombinator.com/item?id=30619103,CapitalistCartr,2022-03-09T19:46:35,8.0
30619336,"Russia admits Conscripts fighting in Ukraine, despite Putin's previous Denials",https://lite.cnn.com/en/article/h_0ae660da28b4de04ee052995bc451a99,https://news.ycombinator.com/item?id=30619336,News-Dog,2022-03-09T20:07:13,8.0
30630620,The Collapse of Putin’s Disinformation Machinery,https://www.wired.com/story/putin-collapse-disinformation-machinery-ukraine/,https://news.ycombinator.com/item?id=30630620,pedro84,2022-03-10T18:36:55,8.0
30786738,DIY Volunteers Are Repairing Ukraine’s Destroyed Internet Infrastructure,https://www.vice.com/en/article/qjbapv/diy-volunteers-are-repairing-ukraines-destroyed-internet-infrastructure,https://news.ycombinator.com/item?id=30786738,RafelMri,2022-03-24T05:57:20,8.0
30641835,Russians liquidating crypto in the UAE to seek safe havens,https://www.reuters.com/business/exclusive-russians-liquidating-crypto-uae-seek-safe-havens-2022-03-11/,https://news.ycombinator.com/item?id=30641835,pseudolus,2022-03-11T16:24:00,8.0
30758996,Russian government bars its scientists from international conferences,https://www.theverge.com/2022/3/21/22988994/russia-science-publication-database-conferences,https://news.ycombinator.com/item?id=30758996,occamschainsaw,2022-03-21T20:02:02,8.0
30627700,Kamil Galeev about mafia and Russian gov/leadership as such,https://twitter.com/kamilkazani/status/1501360272442896388,https://news.ycombinator.com/item?id=30627700,svilen_dobrev,2022-03-10T15:06:33,8.0
30717503,US Pacific Command to Build Anti-China Missile Network on First Island Chain,https://asia.nikkei.com/Politics/International-relations/Indo-Pacific/US-to-build-anti-China-missile-network-along-first-island-chain,https://news.ycombinator.com/item?id=30717503,joshuafkon,2022-03-18T00:51:47,8.0
30660944,MongoDB is terminating Russian accounts,https://twitter.com/brodtoleg/status/1502587827783098371,https://news.ycombinator.com/item?id=30660944,Tomte,2022-03-13T13:13:21,8.0
30620523,‘Pure genocide’: civilian targets in Mariupol ‘annihilated’ by Russian attacks,https://www.theguardian.com/world/2022/mar/09/pure-genocide-civilian-targets-in-mariupol-annihilated-by-russian-attacks,https://news.ycombinator.com/item?id=30620523,sofixa,2022-03-09T21:56:34,8.0
30655705,Russian central bank decides not to reopen stock market trading next week,https://financialpost.com/pmn/business-pmn/russian-central-bank-decides-not-to-reopen-stock-market-trading-next-week,https://news.ycombinator.com/item?id=30655705,awb,2022-03-12T22:43:45,8.0
30608561,Ukraine successfully attacked Russian vehicles in Kyiv thanks to Telegram tip,https://www.businessinsider.com/ukraine-attack-russian-vehicles-kyiv-telegram-tip-2022-3,https://news.ycombinator.com/item?id=30608561,awb,2022-03-08T23:04:17,8.0
30590481,Update 13 – IAEA Director General Statement on Situation in Ukraine,https://www.iaea.org/newscenter/pressreleases/update-13-iaea-director-general-statement-on-situation-in-ukraine,https://news.ycombinator.com/item?id=30590481,jules-jules,2022-03-07T17:17:46,8.0
30608114,Russian central bank imposes $10k limit on foreign cash withdrawals,https://finance.yahoo.com/news/russian-central-bank-imposes-10-211856000.html,https://news.ycombinator.com/item?id=30608114,underscore_ku,2022-03-08T22:25:41,8.0
30651721,Russian Artillery Damages Another Hospital and Mosque Sheltering Children,https://www.usatoday.com/story/news/politics/2022/03/12/ukraine-russia-invasion-live-updates/7008613001/,https://news.ycombinator.com/item?id=30651721,News-Dog,2022-03-12T14:47:44,8.0
30757727,Ukraine rejects Russian demand for surrender in Mariupol,https://www.ctvnews.ca/world/ukraine-rejects-russian-demand-for-surrender-in-mariupol-1.5827338,https://news.ycombinator.com/item?id=30757727,mgh2,2022-03-21T18:20:11,8.0
30740107,"Russian spy chief arrested, officials split over Ukraine invasion",https://www.jpost.com/international/article-701772,https://news.ycombinator.com/item?id=30740107,webmaven,2022-03-20T04:25:54,8.0
30820532,Beating Japan at Its Own [video] Game: A Smash Hit from China,https://www.nytimes.com/2022/03/16/business/genshin-impact-china-japan.html,https://news.ycombinator.com/item?id=30820532,ksec,2022-03-27T14:34:23,8.0
30602108,U.S. will ban Russian oil imports,https://www.cnbc.com/2022/03/08/us-expected-to-announce-ban-on-russian-oil-as-soon-as-today-nbc-news-reports.html,https://news.ycombinator.com/item?id=30602108,awb,2022-03-08T16:50:01,8.0
30742138,"Russia has a $140B stockpile of gold, but no one wants to buy it",https://www.businessinsider.com/russia-has-140-billion-gold-stash-that-no-one-wants-2022-3,https://news.ycombinator.com/item?id=30742138,hippich,2022-03-20T12:36:23,8.0
30742198,“I bought a one-way ticket”: Inside Russia’s sudden tech exodus,https://restofworld.org/2022/inside-russias-sudden-tech-exodus/,https://news.ycombinator.com/item?id=30742198,donohoe,2022-03-20T12:47:37,8.0
30619879,The Ukraine War and the price of bread,https://noahpinion.substack.com/p/the-ukraine-war-and-the-price-of,https://news.ycombinator.com/item?id=30619879,paulpauper,2022-03-09T21:00:55,8.0
30602223,Ask HN: Satellite data analysis for war impact on climate and humans in Ukraine,https://news.ycombinator.com/item?id=30602223,https://news.ycombinator.com/item?id=30602223,Brajeshwar,2022-03-08T16:57:56,8.0
30645160,Russian Mall in St. Petersburg (2 weeks after sanctions),https://www.youtube.com/watch?v=8uYsWLd059Q,https://news.ycombinator.com/item?id=30645160,underscore_ku,2022-03-11T19:51:38,8.0
30662257,"Russia Lost Access to Half Its Reserves, Finance Minister Says",https://www.bloomberg.com/news/articles/2022-03-13/russia-lost-access-to-half-its-reserves-finance-minister-says,https://news.ycombinator.com/item?id=30662257,trifit,2022-03-13T15:44:31,8.0
30806668,YouTube blocks WION for reporting Russian statement,https://www.wionews.com/india-news/youtube-blocks-wion-for-reporting-russian-statement-465552,https://news.ycombinator.com/item?id=30806668,ummonk,2022-03-25T20:21:54,8.0
30643160,Bundle for Ukraine offers more than 500 games for $10,https://www.polygon.com/22967035/bundle-for-ukraine-itchio-list-of-games-charities-donations,https://news.ycombinator.com/item?id=30643160,Paul_S,2022-03-11T17:38:03,8.0
30721253,Secret CIA training program in Ukraine helped Kyiv prepare for Russian invasion,https://news.yahoo.com/exclusive-secret-cia-training-program-in-ukraine-helped-kyiv-prepare-for-russian-invasion-090052743.html,https://news.ycombinator.com/item?id=30721253,Barrera,2022-03-18T12:22:11,8.0
30602954,'We are refugees': Russians flee rising authoritarianism,https://www.aljazeera.com/news/2022/3/8/we-are-refugees-russians-flee-rising-authoritarianism,https://news.ycombinator.com/item?id=30602954,mudro_zboris,2022-03-08T17:43:49,7.0
30692430,Russia will bring US astronaut back to Earth,https://inews.co.uk/news/russia-bring-us-astronaut-back-earth-fears-war-leave-him-stranded-iss-1519383,https://news.ycombinator.com/item?id=30692430,onemoresoop,2022-03-15T22:01:56,7.0
30804853,60% of Russian missiles fail in the field,https://www.reuters.com/business/aerospace-defense/exclusive-us-assesses-up-60-failure-rate-some-russian-missiles-officials-say-2022-03-24/,https://news.ycombinator.com/item?id=30804853,simontheowl,2022-03-25T17:22:23,7.0
30793980,How the Bayraktar TB2 drone became a star of the Ukrainian defense,https://www.armytimes.com/video/2022/03/21/how-a-turkish-drone-became-the-star-of-the-ukrainian-defense-actionable-intelligence/,https://news.ycombinator.com/item?id=30793980,killjoywashere,2022-03-24T18:57:00,7.0
30794174,Russia is open to selling natural gas for Bitcoin,https://bitcoinmagazine.com/markets/russia-open-to-sell-gas-for-bitcoin,https://news.ycombinator.com/item?id=30794174,Barrera,2022-03-24T19:14:39,7.0
30690180,Three EU country leaders arrive in Kyiv in show of support for Ukraine,https://www.reuters.com/world/europe/three-eu-country-leaders-take-train-kyiv-show-support-ukraine-2022-03-15/,https://news.ycombinator.com/item?id=30690180,Paul_S,2022-03-15T19:30:01,7.0
30798917,"Sergei Loznitsa, the Ukrainian film-maker who refuses to be cancelled",https://www.theguardian.com/film/2022/mar/24/putin-is-just-the-frontman-sergei-loznitsa-the-ukrainian-film-maker-who-refuses-to-be-cancelled,https://news.ycombinator.com/item?id=30798917,georgecmu,2022-03-25T05:27:41,7.0
30804122,"A month into the Russian invasion, Ukraine is still mostly online",https://therecord.media/ukraine-internet-russia-invasion/,https://news.ycombinator.com/item?id=30804122,giuliomagnifico,2022-03-25T16:27:39,7.0
30821810,Cloudflare Rufuses to Exit Russian Market,https://som.yale.edu/story/2022/over-450-companies-have-withdrawn-russia-some-remain,https://news.ycombinator.com/item?id=30821810,Mizza,2022-03-27T16:59:10,7.0
30610900,Sanctions on Russia Will Fail Without Diplomacy,https://www.newsweek.com/why-sanctions-russia-will-fail-without-diplomacy-opinion-1686069,https://news.ycombinator.com/item?id=30610900,barry-cotter,2022-03-09T04:20:53,7.0
30694141,Russian diplomat caught on camera recruiting a spy,https://www.youtube.com/watch?v=NrS98C796xA,https://news.ycombinator.com/item?id=30694141,ondrek,2022-03-16T01:21:20,7.0
30761377,Biden warns Russian cyberattacks 'coming',https://www.politico.com/news/2022/03/21/biden-russia-cyberattacks-00018942,https://news.ycombinator.com/item?id=30761377,nathanyz,2022-03-22T00:09:48,7.0
30609352,The bank run in Russia could become a run on the country’s central bank itself,https://www.city-journal.org/russian-bank-run-is-no-ordinary-panic,https://news.ycombinator.com/item?id=30609352,Bostonian,2022-03-09T00:20:46,7.0
30738939,Standing with Ukraine: A Message from the CEO,https://blog.duolingo.com/duolingo-statement-ukraine/,https://news.ycombinator.com/item?id=30738939,bardc,2022-03-20T00:46:44,7.0
30740876,Australia bans export of aluminium ore to Russia over aggression towards Ukraine,https://www.theguardian.com/australia-news/2022/mar/20/australia-bans-exports-of-aluminium-ores-to-russia-over-aggression-towards-ukraine,https://news.ycombinator.com/item?id=30740876,rntn,2022-03-20T07:36:38,7.0
30741005,‘We have to come to protect you’ Russian soldiers told Ukrainian man they’d shot,https://www.theguardian.com/world/2022/mar/19/we-have-to-come-to-protect-you-russian-soldiers-told-ukrainian-man-theyd-shot,https://news.ycombinator.com/item?id=30741005,rntn,2022-03-20T08:12:45,7.0
30607018,Twitter launches a Tor service to help Russians evade censorship,https://www.engadget.com/twitter-tor-onion-service-evade-censorship-210549633.html,https://news.ycombinator.com/item?id=30607018,mhalle,2022-03-08T21:10:21,7.0
30753742,“Israel cancelled visa-free travel for Ukrainians”,https://twitter.com/AKurkov/status/1505770045787541507,https://news.ycombinator.com/item?id=30753742,DyslexicAtheist,2022-03-21T13:15:00,7.0
30755792,"Russia labels Meta an 'extremist organisation', says WhatsApp can stay",https://www.reuters.com/technology/meta-asks-russian-court-dismiss-proceedings-extremism-case-reports-2022-03-21/,https://news.ycombinator.com/item?id=30755792,MikusR,2022-03-21T16:13:01,7.0
30704161,Odesa's Maze-Like Catacombs Could Be Bad News for Russian Invaders,https://www.thedrive.com/the-war-zone/44745/odesas-massive-maze-like-catacombs-could-be-bad-news-for-russian-invaders,https://news.ycombinator.com/item?id=30704161,tomohawk,2022-03-16T21:11:41,7.0
30702852,Russia's state TV hit by stream of resignations,https://www.bbc.co.uk/news/world-europe-60763494,https://news.ycombinator.com/item?id=30702852,LinuxBender,2022-03-16T19:22:37,7.0
30785239,"Ukraine uses facial recognition to identify dead Russian soldiers, minister says",https://www.reuters.com/technology/ukraine-uses-facial-recognition-identify-dead-russian-soldiers-minister-says-2022-03-23/,https://news.ycombinator.com/item?id=30785239,rectang,2022-03-24T00:29:01,7.0
30702751,A Ukrainian Town Deals Russia One of the War’s Most Decisive Routs,https://www.wsj.com/articles/ukraine-russia-voznesensk-town-battle-11647444734,https://news.ycombinator.com/item?id=30702751,stefan_,2022-03-16T19:12:39,7.0
30763087,"Russian Officials Acknowledge 10,000 Dead and 16,000 Injured",https://www.nationalreview.com/news/russian-tabloid-says-defense-ministry-data-show-9861-soldiers-killed-in-ukraine-war-before-deleting-figures/,https://news.ycombinator.com/item?id=30763087,belter,2022-03-22T05:47:47,7.0
30769023,Russia’s tank manufacturer may have run out of parts,https://fortune.com/2022/03/22/russian-tank-manufacturer-sanctions-ukraine-war/,https://news.ycombinator.com/item?id=30769023,SQL2219,2022-03-22T17:35:11,7.0
30604743,Upwork Suspending Operations in Russia and Belarus,https://community.upwork.com/t5/FAQ-Suspended-Operations-in/ct-p/FAQ,https://news.ycombinator.com/item?id=30604743,kull,2022-03-08T19:11:40,7.0
30601797,CERN pauses future research collaboration with Russia,https://www.space.com/cern-stops-future-russia-cooperation-ukraine-protest,https://news.ycombinator.com/item?id=30601797,NmAmDa,2022-03-08T16:29:23,7.0
30603948,"EU lawmakers to push for ban on new 'golden passports', visas for Russians",https://www.reuters.com/world/europe/eu-lawmakers-push-ban-new-golden-passports-visas-russians-2022-03-08/,https://news.ycombinator.com/item?id=30603948,mudro_zboris,2022-03-08T18:38:41,7.0
30696954,Ukrainian researchers pressure journals to boycott Russian authors,https://www.nature.com/articles/d41586-022-00718-y,https://news.ycombinator.com/item?id=30696954,pseudolus,2022-03-16T09:55:15,7.0
30766549,Ukraine suspends 11 political parties with links to Russia,https://www.theguardian.com/world/2022/mar/20/ukraine-suspends-11-political-parties-with-links-to-russia,https://news.ycombinator.com/item?id=30766549,_-david-_,2022-03-22T14:33:22,7.0
30601827,"US Announced Ban on Russian Oil, Gas and Coal",https://www.cbsnews.com/live-updates/biden-russia-oil-ban-ukraine-watch-live-stream-today-2022-03-08/,https://news.ycombinator.com/item?id=30601827,already,2022-03-08T16:31:17,7.0
30651056,Russia concentrates military power for Kyiv assault,https://kyivindependent.com/national/russia-concentrates-military-power-for-kyiv-assault/,https://news.ycombinator.com/item?id=30651056,baylearn,2022-03-12T13:01:21,7.0
30651691,9 years ago China promised to protect a country if there’s nuclear war: Ukraine,https://www.wsj.com/articles/under-new-scrutiny-chinas-nuclear-pledge-to-ukraine-11647007200,https://news.ycombinator.com/item?id=30651691,cwwc,2022-03-12T14:43:18,7.0
30625560,Why Lying in Russia Has Become a National Pastime,https://www.themoscowtimes.com/2012/10/22/why-lying-has-become-a-national-pastime-a18754,https://news.ycombinator.com/item?id=30625560,curtisblaine,2022-03-10T11:02:14,7.0
30655214,Putin Is Being Canceled,https://www.theatlantic.com/ideas/archive/2022/03/russia-ukraine-war-cancel-putin-culture-war/626978/,https://news.ycombinator.com/item?id=30655214,html5web,2022-03-12T21:47:05,7.0
30668250,Ukraine has started using Clearview AI’s facial recognition during war,https://www.cnbc.com/2022/03/13/ukraine-has-started-using-clearview-ais-facial-recognition-during-war.html,https://news.ycombinator.com/item?id=30668250,pgodzin,2022-03-14T03:30:23,7.0
30654833,Putin’s pre-war moves against U.S. tech giants,https://www.washingtonpost.com/world/2022/03/12/russia-putin-google-ap,https://news.ycombinator.com/item?id=30654833,wslh,2022-03-12T21:00:30,7.0
30618315,YouTube deleted Ukraine On Fire film. Director asks everyone to distribute it.,https://twitter.com/lopatonok/status/1501433087565000704,https://news.ycombinator.com/item?id=30618315,zrm,2022-03-09T18:37:10,7.0
